Title,Author,Genres,Avg_Rating,Num_Ratings,Num_Reviews,Description,Book_URL
I'm Glad You're Dead: Preternatural Chronicles Book 1,"Hunter Blain, Hunter Blain","Fantasy, Science Fiction Fantasy, Novels, Epic, Fiction, High Fantasy, Speculative Fiction, Adventure, Magic, Epic Fantasy",4.20,"2,515 ratings",110 reviews,"My name is John Cook, and my life began the day my heart stopped beating.

You meet the most interesting men in Medieval prisons. This one time, I met a guy who offered me immortality for the low, low price of changing my diet. I didn’t read the fine print. Because he wasn’t talking about a gluten free diet. More like hemoglobin full.

And now I’m a friggin’ vampire with five centuries of pop culture references.

Granted, at the time, I was listening to the dying screams of my mother and father being burned and eviscerated alive just outside the rusty bars of the prison cell, and my new best friend was offering me my only real chance at saving my own life and avenging my parents’ murderers—some day.

Except my first chance at vengeance took about five hundred years, and I had to wade through oceans of sin and violence, blackening my soul—and my already dark sense of humor—beyond redemption until I met Father Thomes—a Roman Catholic Priest—in present-day Houston. Papa Thomes taught me how to use my dark curse to fight for the good guys. Like Alfred and Robin did for Batman—except we straight up murder Jokers and Two-Faces. .

We stand up for the downtrodden, the forgotten, and the neglected…

By exsanguinating the wicked in horrific, truly imaginative ways, and having a grand ol’ time doing it. You know what they say about doing what you love…

But our party is soon cut short when we learn the End of Days is just around the corner, and that the fine print of my contract might have hidden a few other tidbits. Like the fact that I was central to kicking off the Apocalypse, and that the Archdemons will stop at nothing to make sure by the terms of his contract.

I guess I need a lawyer.

Get ready to laugh at extreme violence. I know I will. If you’re not laughing, you’re learning.









★★★★★ ‘Let me count the ways I blood thee…’

★★★★★ ‘Move over Dresden!’

★★★★★ ‘The Preternatural Chronicles MUST come to Netflix. Now.’

★★★★★ ‘John Cook puts the G.O.A.T. in gloat.’

★★★★★ ‘Shayne Silvers has found the next author to take over Urban Fantasy.’

★★★★★ ‘I need John Cook to have a story with Nate Temple. Please.’

★★★★★ ‘John Cook loves vegans. Especially when they are served raw.’

★★★★★ ‘The only thing that sparkles about this vampire is his fangs in the moonlight.’

★★★★★ ‘All the twisted humor of Pulp Fiction, but with a vampire. It’s more like Gulp Fiction.",https://www.goodreads.com/book/show/197891975-i-m-glad-you-re-dead
The Art of Avoiding Your Alpha,"Lola Glass, Lola Glass","Fantasy, Science Fiction Fantasy, Romance, Novels, Fiction, Epic Fantasy, Paranormal, Speculative Fiction, Magic, Adventure",3.87,"5,471 ratings",267 reviews,"My soulmate bought me a sugar cookie… and now, he's not going to let me go.

He wants a mate bond.

I don't.

He's even more stubborn than I am, though. So, I agree to move in with him, for the sake of putting more emotional distance between us.

But the plan backfires.

And it makes me like him more.

If I can't convince him to walk away, I'm eventually going to have to accept a difficult truth:

I've never met anyone I want to avoid less than him.

This is a steamy, fun, full-length standalone romance with a happily ever after",https://www.goodreads.com/book/show/208567667-the-art-of-avoiding-your-alpha
House of Vampires and Flame,"Meg Xuemei X, Meg Xuemei X","Fantasy, Vampires, Magic, Adventure, Science Fiction Fantasy, Epic, Speculative Fiction, Novels, Romance, Fiction",4.12,"5,144 ratings",303 reviews,"The gods are dead.

At least, that’s what everyone else seems to think.

I, however, know the truth. My father, the God of Ruin, is coming, and with him, everything will fall.

Hiding out at this dangerous academy can only protect me for so long, even if I am disguised as a boy to avoid the brutal Bride Trials.

One of the cruel princes of the school, Killian, watches me from the shadows.

Waiting.

Biding his time.

I fear that when he catches me, he’ll either be my salvation…

Or my downfall.",https://www.goodreads.com/book/show/197375895-house-of-vampires-and-flame
The Coming of Conan the Cimmerian,"Robert E. Howard, Robert E. Howard","Fantasy, Fiction, Sword and Sorcery, Short Stories, Classics, Pulp, Adventure, Audiobook, Horror, Science Fiction Fantasy",4.16,"14,648 ratings",832 reviews,"Fourteen short stories featuring Conan the Barbarian present in the first of three intended volumes several of the sword-wielding fantasy hero's most popular adventures, complemented by lavish black-and-white illustrations as well as a number of the author's original drafts and synopses.

Poem and first 13 tales, in order written, plus Miscellanea drafts, notes, maps by author.
Cimmeria poem
1 The Phoenix on the Sword 1932
2 The Frost-Giant's Daughter 1976
3 The God in the Bowl 1952
4 The Tower of the Elephant 1933
5 The Scarlet Citadel 1933
6 Queen of the Black Coast 1934
7 Black Colossus 1933
8 Iron Shadows in the Moon 1934
9 Xuthal of the Dusk 1933
10 The Pool of the Black One 1933
11 Rogues in the House 1934
12 The Vale of Lost Women 1967
13 The Devil in Iron 1934",https://www.goodreads.com/book/show/33482.The_Coming_of_Conan_the_Cimmerian
The Wonderful Wizard of Oz,"L. Frank Baum, W.W. Denslow, L. Frank Baum","Classics, Fantasy, Fiction, Childrens, Young Adult, Audiobook, Adventure, Middle Grade, Magic, Literature",4.00,"505,043 ratings","20,694 reviews","Come along, Toto, she said. We will go to the Emerald City and ask the Great Oz how to get back to Kansas again.
Swept away from her home in Kansas by a tornado, Dorothy and her dog Toto find themselves stranded in the fantastical Land of Oz. As instructed by the Good Witch of the North and the Munchkins, Dorothy sets off on the yellow brick road to try and find her way to the Emerald City and the Wizard of Oz, who can help her get home. With her companions the Scarecrow, the Tin Woodman and the Cowardly Lion, Dorothy experiences an adventure full of friendship, magic and danger. A much-loved children's classic, The Wizard of Oz continues to delight readers young and old with its enchanting tale of witches, flying monkeys and silver shoes.",https://www.goodreads.com/book/show/236093.The_Wonderful_Wizard_of_Oz
Oathbringer,"Brandon Sanderson, Brandon Sanderson","Fantasy, Fiction, Audiobook, Epic Fantasy, High Fantasy, Adult, Magic, Epic, Science Fiction Fantasy, Adventure",4.61,"343,246 ratings","23,441 reviews","In Oathbringer, the third volume of the New York Times bestselling Stormlight Archive, humanity faces a new Desolation with the return of the Voidbringers, a foe with numbers as great as their thirst for vengeance.

Dalinar Kholin's Alethi armies won a fleeting victory at a terrible cost: The enemy Parshendi summoned the violent Everstorm, which now sweeps the world with destruction, and in its passing awakens the once peaceful and subservient parshmen to the horror of their millennia-long enslavement by humans. While on a desperate flight to warn his family of the threat, Kaladin Stormblessed must come to grips with the fact that the newly kindled anger of the parshmen may be wholly justified.

Nestled in the mountains high above the storms, in the tower city of Urithiru, Shallan Davar investigates the wonders of the ancient stronghold of the Knights Radiant and unearths dark secrets lurking in its depths. And Dalinar realizes that his holy mission to unite his homeland of Alethkar was too narrow in scope. Unless all the nations of Roshar can put aside Dalinar's blood-soaked past and stand together--and unless Dalinar himself can confront that past--even the restoration of the Knights Radiant will not prevent the end of civilization.",https://www.goodreads.com/book/show/34002132-oathbringer
Lucky Son of a Gun,"John Conroe, John Conroe","Epic Fantasy, Science Fiction Fantasy, Fantasy, Epic, Magic, Speculative Fiction, High Fantasy, Novels, Fiction, Adventure",4.47,"2,322 ratings",74 reviews,"Mack Sutton is a normal guy who just happens to attend a very abnormal school. In a college where the pretty girls can kill you with a whisper and most of the guys can bench press a car, Mack and his sister Jetta are just run of the mill people -- or are they?

Formerly published on the Kindle Vella platform, this novel of the Demon Accords gives a glimpse into the lives of the only non-supernatural kids in College Arcane.",https://www.goodreads.com/book/show/203552477-lucky-son-of-a-gun
The Darkness That Comes Before,"R. Scott Bakker, R. Scott Bakker","Fantasy, Fiction, Epic Fantasy, Dark Fantasy, High Fantasy, Science Fiction Fantasy, Epic, Philosophy, Dark, Audiobook",3.84,"23,379 ratings","1,528 reviews","The first book in R. Scott Bakker's Prince of Nothing series creates a world from whole cloth-its language and classes of people, its cities, religions, mysteries, taboos, and rituals. It's a world scarred by an apocalyptic past, evoking a time both two thousand years past and two thousand years into the future, as untold thousands gather for a crusade. Among them, two men and two women are ensnared by a mysterious traveler, Anasûrimbor Kellhus - part warrior, part philosopher, part sorcerous, charismatic presence - from lands long thought dead. The Darkness That Comes Before is a history of this great holy war, and like all histories, the survivors write its conclusion.",https://www.goodreads.com/book/show/301538.The_Darkness_That_Comes_Before
"Being a Witch, and Other Things I Didn't Ask For","Sara Pascoe, Sara Pascoe","Adventure, Novels, Fiction, Young Adult, Action, Book Club, Teen, Fantasy, Science Fiction Fantasy, Magic",4.28,"26,457 ratings",155 reviews,"Raya’s burgeoning psychic and time-travel powers could freak anybody out. But they're that much weirder when you're an emotionally wounded, smart-mouthed, foster kid. After accidentally flinging herself to 1645 England amidst their deadliest witch trials, along with an equally smart-aleck talking cat, people try to help her come home. But instead she sticks her fingers in it again, and transports to 1645 Istanbul, where life is leaps and bounds beyond England. There she meets extraordinary historical figures as well as ordinary people. She starts to let love in, and begins to heal. “Raya’s bittersweet memories of her mother are absolutely heartbreaking and serve as an important touchstone for readers who may have experienced similar trauma. The author’s talent for balancing real-world issues with adrenaline-pumping exploits through time (including a perilous sojourn to 17th-century Istanbul) is impressive, as are her richly detailed descriptions of various people and places.”
Kirkus Reviews – Verdict: Get it.",https://www.goodreads.com/book/show/34186576-being-a-witch-and-other-things-i-didn-t-ask-for
Before They Are Hanged,"Joe Abercrombie, Joe Abercrombie","Fantasy, Fiction, Audiobook, Epic Fantasy, High Fantasy, Dark Fantasy, Adventure, Adult, Science Fiction Fantasy, Magic",4.36,"210,931 ratings","10,732 reviews","How do you defend a city surrounded by enemies and riddled with traitors, when your allies can by no means be trusted, and your predecessor vanished without a trace? It’s enough to make a torturer want to run – if he could even walk without a stick – and Superior Glokta needs answers before the Gurkish army comes knocking at the gates.

Northmen have spilled over the border of Angland and are spreading fire and death across the frozen country. Crown Prince Ladisla is poised to drive them back and win undying glory. There is only one problem – he commands the worst-armed, worst-trained, worst-led army in the world.

And Bayaz, the First of the Magi, is leading a party of bold adventurers on a perilous mission through the ruins of the past. The most hated woman in the South, the most feared man in the North, and the most selfish boy in the Union make a strange alliance, but a deadly one. They might even stand a chance of saving mankind from the Eaters. If they didn't hate each other quite so much.

Ancient secrets will be uncovered. Bloody battles will be won and lost. Bitter enemies will be forgiven – but not before they are hanged.",https://www.goodreads.com/book/show/902715.Before_They_Are_Hanged
The Bone Doll's Twin,"Lynn Flewelling, Lynn Flewelling","Fantasy, Fiction, High Fantasy, Epic Fantasy, Magic, LGBT, Queer, Science Fiction Fantasy, Dark Fantasy, Adult",4.07,"13,222 ratings",703 reviews,"Sometimes the price of destiny is higher than anyone imagined....

Dark Magic, Hidden Destiny

For three centuries a divine prophecy and a line of warrior queens protected Skala. But the people grew complacent and Erius, a usurper king, claimed his young half sister’s throne.

Now plague and drought stalk the land, war with Skala’s ancient rival Plenimar drains the country’s lifeblood, and to be born female into the royal line has become a death sentence as the king fights to ensure the succession of his only heir, a son. For King Erius the greatest threat comes from his own line — and from Illior’s faithful, who spread the Oracle’s words to a doubting populace.

As noblewomen young and old perish mysteriously, the king’s nephew — his sister’s only child — grows toward manhood. But unbeknownst to the king or the boy, strange, haunted Tobin is the princess’s daughter, given male form by a dark magic to protect her until she can claim her rightful destiny.

Only Tobin’s noble father, two wizards of Illior, and an outlawed forest witch know the truth. Only they can protect young Tobin from a king’s wrath, a mother’s madness, and the terrifying rage of her brother’s demon spirit, determined to avenge his brutal murder....",https://www.goodreads.com/book/show/671560.The_Bone_Doll_s_Twin
The Thief,"Megan Whalen Turner, Megan Whalen Turner","Fantasy, Young Adult, Fiction, Adventure, Historical Fiction, Audiobook, Young Adult Fantasy, Mythology, High Fantasy, Historical",3.85,"92,774 ratings","11,143 reviews","Nothing is overdone and not a word is out of place in this auspicious debut,"" wrote Kirkus in a starred review of Instead of Three Wishes, the first book by Megan Whalen Turner. Her second book more than fulfills that promise.

The king's scholar, the magus, believes he knows the site of an ancient treasure. To attain it for his king, he needs a skillful thief, and he selects Gen from the king's prison. The magus is interested only in the thief's abilities. What Gen is interested in is anyone's guess. Their journey toward the treasure is both dangerous and difficult, lightened only imperceptibly by the tales they tell of the old gods and goddesses.

Megan Whalen Turner weaves Gen's stories and Gen's story together with style and verve in a novel that is filled with intrigue, adventure, and surprise.",https://www.goodreads.com/book/show/448873.The_Thief
The Forgotten Beasts of Eld,"Patricia A. McKillip, Patricia A. McKillip","Fantasy, Fiction, Young Adult, Dragons, Romance, High Fantasy, Magic, Science Fiction Fantasy, Classics, Young Adult Fantasy",4.07,"21,013 ratings","2,278 reviews","Sixteen when a baby is brought to her to raise, Sybel has grown up on Eld Mountain. Her only playmates are the creatures of a fantastic menagerie called there by wizardry. Sybel has cared nothing for humans, until the baby awakens emotions previously unknown to her. And when Coren—the man who brought this child—returns, Sybel's world is again turned upside down.",https://www.goodreads.com/book/show/81069.The_Forgotten_Beasts_of_Eld
Last Argument of Kings,"Joe Abercrombie, Joe Abercrombie","Fantasy, Fiction, Audiobook, Epic Fantasy, Dark Fantasy, High Fantasy, Adventure, Adult, Science Fiction Fantasy, Magic",4.36,"194,633 ratings","11,121 reviews","The end is coming.

Logen Ninefingers might only have one more fight in him, but it's going to be a big one. Battle rages across the North, the King of the Northmen still stands firm, and there's only one man who can stop him. His oldest friend, and his oldest enemy: it's time for the Bloody-Nine to come home.

With too many masters and too little time, Superior Glokta is fighting a different kind of war. A secret struggle in which no-one is safe, and no-one can be trusted. And, as his days with a sword are far behind him, it's fortunate that he's deadly with his remaining weapons: threats, blackmail and torture.

Jezal dan Luthar has decided that winning glory is too painful an undertaking and turned his back on soldiering for a simple life with the woman he loves. But love can be painful too – and glory has a nasty habit of creeping up on a man when he least expects it.

While the King of the Union lies on his deathbead, the peasants revolt and the nobles scramble to steal his crown. No-one believes that the shadow of war is about to fall across the heart of the Union. Only the First of the Magi has a plan to save the world – as he always does – but this time there are risks. There is no risk more terrible, after all, than to break the First Law...",https://www.goodreads.com/book/show/944076.Last_Argument_of_Kings
Brisingr,"Christopher Paolini, Christopher Paolini","Fantasy, Young Adult, Fiction, Dragons, Adventure, Magic, High Fantasy, Audiobook, Epic Fantasy, Young Adult Fantasy",4.11,"410,904 ratings","11,997 reviews","Під час битви з Імперією на Палаючій рівнині Ерагон та його дракон Сапфіра ледь не загинули. Вершник готовий завдати удар у відповідь, але на заваді стоять його обіцянки.
Найперше — це обіцянка своєму братові Рорану визволити його кохану Катріну з полону короля Гальбаторікса. Але не тільки це. Ерагон дав клятву вірності і варденам, і ельфам, і гномам. Тож коли небезпека чатує на повстанців з усіх боків, Вершник має зробити свій вибір, що стане його справжнім випробовуванням.",https://www.goodreads.com/book/show/2248573.Brisingr
The Redemption of Althalus,"David Eddings, Leigh Eddings, David Eddings","Fantasy, Fiction, Science Fiction Fantasy, High Fantasy, Epic Fantasy, Adventure, Magic, Adult, Epic, Audiobook",3.85,"16,894 ratings",651 reviews,"The Redemption of Althalus is the first stand-alone, single-volume high fantasy saga written by the bestselling husband and wife team of David and Leigh Eddings. Their previous beloved series include the Belgariad, the Malloreon, and the Elenium, and although Althalus is bursting with all the daring escapades their multitude of fans expect, it is also an engaging departure for the authors. Althalus is a grand adventure that is bound to enthrall readers of the authors' previous, multivolume epics, but it features a precision of plot and language that can be achieved only by having an actual resolution.",https://www.goodreads.com/book/show/110692.The_Redemption_of_Althalus
"Sheever's Journal, Diary of a Poison Master","K. Ritz, K. Ritz","Fiction, Novels, Epic, Adventure, Book Club, Science Fiction Fantasy, Drama, Fantasy, Magic, Speculative Fiction",4.29,"27,215 ratings",48 reviews,"Synopsis:
For five years Me’acca Mysuth Sheever has lived among his “sworn enemies,” pretending to be one of them. One night he buys a journal, its pages blank. The woman who sells him the journal extracts his promise to record his deeds for study. “Lo, the steps of your life mark the journey of your soul.” To expose his prior life, however, would be akin to suicide, for Sheever is a man brimming with secrets.

He begins the journal cautiously, describing the area where he works as a cook, and the people he’s forced to endure. Hints of his past emerge as he also records day-to-day events. As the journal evolves, he finds himself more entangled than he ever wanted to be in the lives around him, and more sympathetic to people he wanted to hate.

Memories haunt him, and he struggles to maintain a grip on his sanity as he prays for – and fears – the signal that his years in exile have ended and he can return home.

This then is Sheever’s Journal, Diary of a Poison Master.

About the Author:
K. Ritz lives with her husband in a small town in Massachusetts. This is her first book in a series about a world of shadows.",https://www.goodreads.com/book/show/52022378-sheever-s-journal-diary-of-a-poison-master
Beowulf,"Beowulf Poet, Seamus Heaney, Beowulf Poet","Classics, Poetry, Fiction, Fantasy, Mythology, School, Literature, Read For School, Medieval, Historical Fiction",3.50,"342,644 ratings","13,200 reviews","Composed toward the end of the first millennium, Beowulf is the elegiac narrative of the adventures of Beowulf, a Scandinavian hero who saves the Danes from the seemingly invincible monster Grendel and, later, from Grendel's mother. He then returns to his own country and dies in old age in a vivid fight against a dragon. The poem is about encountering the monstrous, defeating it, and then having to live on in the exhausted aftermath. In the contours of this story, at once remote and uncannily familiar at the beginning of the twenty-first century, Nobel laureate Seamus Heaney finds a resonance that summons power to the poetry from deep beneath its surface. Drawn to what he has called the ""four-squareness of the utterance"" in Beowulf and its immense emotional credibility, Heaney gives these epic qualities new and convincing reality for the contemporary reader.",https://www.goodreads.com/book/show/52357.Beowulf
Harry Potter and the Philosopher’s Stone,"J.K. Rowling, J.K. Rowling","Fantasy, Fiction, Young Adult, Harry Potter, Magic, Childrens, Middle Grade, Audiobook, Classics, Adventure",4.47,"11,233,236 ratings","188,903 reviews","Harry Potter thinks he is an ordinary boy - until he is rescued by an owl, taken to Hogwarts School of Witchcraft and Wizardry, learns to play Quidditch and does battle in a deadly duel. The Reason ... HARRY POTTER IS A WIZARD!",https://www.goodreads.com/book/show/72193.Harry_Potter_and_the_Philosopher_s_Stone
Poison Study,"Maria V. Snyder, Maria V. Snyder","Fantasy, Young Adult, Romance, Magic, Fiction, Young Adult Fantasy, High Fantasy, Paranormal, Fantasy Romance, Adventure",4.09,"175,185 ratings","14,928 reviews","Choose: A quick death… or slow poison...

About to be executed for murder, Yelena is offered an extraordinary reprieve. She'll eat the best meals, have rooms in the palace—and risk assassination by anyone trying to kill the Commander of Ixia.

And so Yelena chooses to become a food taster. But the chief of security, leaving nothing to chance, deliberately feeds her Butterfly's Dust—and only by appearing for her daily antidote will she delay an agonizing death from the poison.

As Yelena tries to escape her new dilemma, disasters keep mounting. Rebels plot to seize Ixia and Yelena develops magical powers she can't control. Her life is threatened again and choices must be made. But this time the outcomes aren't so clear...",https://www.goodreads.com/book/show/60510.Poison_Study
Prince of Fools,"Mark Lawrence, Mark Lawrence","Fantasy, Fiction, Epic Fantasy, High Fantasy, Dark Fantasy, Audiobook, Adult, Magic, Adventure, Science Fiction Fantasy",4.05,"35,055 ratings","2,639 reviews","The Red Queen is old but the kings of the Broken Empire dread her like no other. For all her reign, she has fought the long war, contested in secret, against the powers that stand behind nations, for higher stakes than land or gold. Her greatest weapon is The Silent Sister—unseen by most and unspoken of by all.The Red Queen’s grandson, Prince Jalan Kendeth—drinker, gambler, seducer of women—is one who can see The Silent Sister. Tenth in line for the throne and content with his role as a minor royal, he pretends that the hideous crone is not there. But war is coming. Witnesses claim an undead army is on the march, and the Red Queen has called on her family to defend the realm. Jal thinks it’s all a rumor—nothing that will affect him—but he is wrong.After escaping a death trap set by the Silent Sister, Jal finds his fate magically intertwined with a fierce Norse warrior. As the two undertake a journey across the Empire to undo the spell, encountering grave dangers, willing women, and an upstart prince named Jorg Ancrath along the way, Jalan gradually catches a glimmer of the he and the Norseman are but pieces in a game, part of a series of moves in the long war—and the Red Queen controls the board.",https://www.goodreads.com/book/show/18693743-prince-of-fools
