Title,Author,Genres,Avg_Rating,Num_Ratings,Num_Reviews,Description,Book_URL
Elric of Melniboné,"Michael Moorcock, Michael Moorcock","Fantasy, Fiction, Sword and Sorcery, Dark Fantasy, Epic Fantasy, High Fantasy, Classics, Audiobook, Science Fiction Fantasy, Science Fiction",3.89,"30,770 ratings","1,801 reviews","Elric of Melniboné is a requisite title in the hard fantasy canon, a book no fantasy fan should leave unread. Author Michael Moorcock, already a major player in science fiction, cemented his position in the fantasy pantheon with the five-book Elric saga, of which Elric of Melniboné is the first installment. The book's namesake, the brooding albino emperor of the dying nation of Melniboné, is a sort of Superman for Goths, truly an archetype of the genre.

The youthful Elric is a cynical and melancholy king, heir to a nation whose 100,000-year rule of the world ended less than 500 years hence. More interested in brooding contemplation than holding the throne, Elric is a reluctant ruler, but he also realizes that no other worthy successor exists and the survival of his once-powerful, decadent nation depends on him alone. Elric's nefarious, brutish cousin Yrkoon has no patience for his physically weak kinsman, and he plots constantly to seize Elric's throne, usually over his dead body. Elric of Melniboné follows Yrkoon's scheming, reaching its climax in a battle between Elric and Yrkoon with the demonic runeblades Stormbringer and Mournblade. In this battle, Elric gains control of the soul-stealing Stormbringer, an event that proves pivotal to the Elric saga. --Paul Hughes",https://www.goodreads.com/book/show/30036.Elric_of_Melnibon_
The Deed of Paksenarrion,"Elizabeth Moon, Elizabeth Moon","Fantasy, Fiction, Epic Fantasy, High Fantasy, Science Fiction Fantasy, Adventure, Military Fiction, Epic, Magic, Science Fiction",4.33,"14,058 ratings",794 reviews,"The Deed of Paksenarrion revolves around the life of Paksenarrion Dorthansdotter, known as Paks. It takes place in a fictional medieval world comprised of kingdoms of humans, dwarves, and elves. The story begins by introducing Paks as a headstrong girl of 18, who leaves her home (fleeing a marriage arranged by her father) to join a mercenary company. Through her journeys and hardships she comes to realize that she has been gifted as a paladin. The novel was originally published in three volumes in 1988 and 1989 and as a single trade edition of that name in 1992. The three books included are The Sheepfarmer's Daughter, Divided Allegiance and Oath of Gold.

From publisher Baen: ""Paksenarrion, a simple sheepfarmer's daughter, yearns for a life of adventure and glory, such as was known to heroes in songs and story. At age seventeen she runs away from home to join a mercenary company and begins her epic life . . . Book One: Paks is trained as a mercenary, blooded, and introduced to the life of a soldier . . . and to the followers of Gird, the soldier's god. Book Two: Paks leaves the Duke's company to follow the path of Gird alone—and on her lonely quests encounters the other sentient races of her world. Book Three: Paks the warrior must learn to live with Paks the human. She undertakes a holy quest for a lost elven prince that brings the gods' wrath down on her and tests her very limits.""",https://www.goodreads.com/book/show/96281.The_Deed_of_Paksenarrion
The Icewind Dale Trilogy Collector's Edition,"R.A. Salvatore, R.A. Salvatore","Fantasy, Forgotten Realms, Fiction, Epic Fantasy, High Fantasy, Science Fiction Fantasy, Dungeons and Dragons, Adventure, Novels, Adult",4.32,"16,945 ratings",280 reviews,"Icewind Dale. Windswept passes and forbidding glaciers stand at the top of the world. Below them, in the cold valleys, an evil force broods: the magic of Crenshinibon, the crystal shard.
Now dwarf, barbarian, and drow elf join to battle this evil. Tempered in the furnace of struggle, they form an unbreakable friendship.
A legend is born.
For the first time in one volume, here is ""New York Times"" bestselling author R.A. Salvatore's adventure that introduced Drizzt Do'Urden, the heroic dark elf, one of the most beloved characters in fantasy literature.",https://www.goodreads.com/book/show/62485.The_Icewind_Dale_Trilogy_Collector_s_Edition
The Hero and the Crown,"Robin McKinley, Robin McKinley","Fantasy, Young Adult, Fiction, Dragons, Adventure, Romance, Magic, Science Fiction Fantasy, High Fantasy, Young Adult Fantasy",4.21,"54,907 ratings","2,786 reviews","Aerin could not remember a time when she had not known the story; she had grown up knowing it.

It was the story of her mother, the witchwoman who enspelled the king into marrying her, to get an heir that would rule Damar; and it was told that she turned her face to the wall and died of despair when she found she had borne a daughter instead of a son.
Aerin was that daughter.

But there was more of the story yet to be told; Aerin's destiny was greater than even she had dreamed--for she was to be the true hero who would wield the power of the Blue Sword...",https://www.goodreads.com/book/show/77366.The_Hero_and_the_Crown
The Curse of Chalion,"Lois McMaster Bujold, Lois McMaster Bujold","Fantasy, Fiction, Audiobook, High Fantasy, Epic Fantasy, Romance, Science Fiction Fantasy, Magic, Adult, Science Fiction",4.18,"42,333 ratings","3,352 reviews","A man broken in body and spirit, Cazaril, has returned to the noble household he once served as page, and is named, to his great surprise, as the secretary-tutor to the beautiful, strong-willed sister of the impetuous boy who is next in line to rule.

It is an assignment Cazaril dreads, for it will ultimately lead him to the place he fears most, the royal court of Cardegoss, where the powerful enemies, who once placed him in chains, now occupy lofty positions. In addition to the traitorous intrigues of villains, Cazaril and the Royesse Iselle, are faced with a sinister curse that hangs like a sword over the entire blighted House of Chalion and all who stand in their circle. Only by employing the darkest, most forbidden of magics, can Cazaril hope to protect his royal charge—an act that will mark the loyal, damaged servant as a tool of the miraculous, and trap him, flesh and soul, in a maze of demonic paradox, damnation, and death.",https://www.goodreads.com/book/show/61886.The_Curse_of_Chalion
Daughter of the Empire,"Raymond E. Feist, Janny Wurts, Raymond E. Feist","Fantasy, Fiction, Epic Fantasy, High Fantasy, Science Fiction Fantasy, Audiobook, Adult, Science Fiction, Epic, Magic",4.29,"41,253 ratings","1,461 reviews","Magic and murder engulf the realm of Kelewan.  Fierce warlords ignite a bitter blood feud to enslave the empire of Tsuranuanni.  While in the opulent Imperial courts, assassins and spy-master plot cunning and devious intrigues against the rightful heir.  Now Mara, a young, untested Ruling lady, is called upon to lead her people in a heroic struggle for survival.  But first she must rally an army of rebel warriors, form a pact with the alien cho-ja, and marry the son of a hated enemy.  Only then can Mara face her most dangerous foe of all--in his own impregnable stronghold.  An epic tale of adventure and intrigue.  Daughter of the Empire is fantasy of the highest order by two of the most talented writers in the field today.",https://www.goodreads.com/book/show/589979.Daughter_of_the_Empire
The Last Unicorn,"Peter S. Beagle, Patrick Rothfuss, Peter S. Beagle","Fantasy, Classics, Fiction, Young Adult, Childrens, Adventure, Science Fiction Fantasy, Magic, Unicorns, High Fantasy",4.16,"121,209 ratings","7,925 reviews","Alternate cover edition of ISBN 9780451450524

She was magical, beautiful beyond belief—and completely alone...

The unicorn had lived since before memory in a forest where death could touch nothing. Maidens who caught a glimpse of her glory were blessed by enchantment they would never forget. But outside her wondrous realm, dark whispers and rumours carried a message she could not ignore: ""Unicorns are gone from the world.""

Aided by a bumbling magician and an indomitable spinster, she set out to learn the truth. but she feared even her immortal wisdom meant nothing in a world where a mad king's curse and terror incarnate lived only to stalk the last unicorn to her doom...",https://www.goodreads.com/book/show/29127.The_Last_Unicorn
King of Thorns,"Mark Lawrence, Mark Lawrence","Fantasy, Fiction, Dark Fantasy, Epic Fantasy, Audiobook, High Fantasy, Post Apocalyptic, Dark, Magic, Science Fiction",4.18,"70,221 ratings","3,408 reviews","Het is inmiddels vier jaar geleden dat prins Jorg van Ancrath en zijn bende wildemannen het kasteel van zijn oom met geweld veroverden. Een daad waarmee Jorg niet alleen zijn eigen familie de oorlog verklaarde, maar ook een die het hele land in rep en roer bracht.

Het duurt dan ook niet lang of de troepen van Jorgs vader en diens bondgenoten trekken op naar de prinsenburcht. Hoewel Jorg over heel wat trouwe manschappen beschikt, zijn het er duidelijk te weinig om met succes weerstand te kunnen bieden aan de immense aanvalsmacht. Alle ogen zijn nu gericht op Jorg, maar deze keer lijkt de jeugdige held net zo machteloos te staan als zijn volgelingen. Tot hij op een zekere nacht wordt geplaagd door een verschrikkelijke nachtmerrie...",https://www.goodreads.com/book/show/12891107-king-of-thorns
Best Served Cold,"Joe Abercrombie, Joe Abercrombie","Fantasy, Fiction, Audiobook, Epic Fantasy, Dark Fantasy, High Fantasy, Adventure, Adult, Science Fiction Fantasy, Dark",4.24,"108,755 ratings","6,407 reviews","Springtime in Styria. And that means war.

There have been nineteen years of blood. The ruthless Grand Duke Orso is locked in a vicious struggle with the squabbling League of Eight, and between them they have bled the land white. While armies march, heads roll and cities burn, behind the scenes bankers, priests and older, darker powers play a deadly game to choose who will be king.

War may be hell, but for Monza Murcatto, the Snake of Talins, the most feared and famous mercenary in Duke Orso's employ, it's a damn good way of making money too. Her victories have made her popular - a shade too popular for her employer's taste. Betrayed, thrown down a mountain and left for dead, Murcatto's reward is a broken body and a burning hunger for vengeance. Whatever the cost, seven men must die.

Her allies include Styria's least reliable drunkard, Styria's most treacherous poisoner, a mass-murderer obsessed with numbers and a Barbarian who just wants to do the right thing. Her enemies number the better half of the nation. And that's all before the most dangerous man in the world is dispatched to hunt her down and finish the job Duke Orso started...

Springtime in Styria. And that means revenge.",https://www.goodreads.com/book/show/2315892.Best_Served_Cold
On a Pale Horse,"Piers Anthony, Piers Anthony","Fantasy, Fiction, Science Fiction, Urban Fantasy, Science Fiction Fantasy, Audiobook, Magic, Death, Supernatural, Paranormal",4.13,"41,305 ratings","1,980 reviews","When Zane shoots Death, he has to take the job, speeding over the world riding Mortis, his pale horse/limo, measuring souls for the exact balance of Good and Evil, sending each to Heaven or Hell instead of Purgatory. The new Thanatos is superbly competent, ends pain when he ends lives. But Satan is forging a trap for Luna, the woman Death loves.",https://www.goodreads.com/book/show/76658.On_a_Pale_Horse
The Well of Ascension,"Brandon Sanderson, Brandon Sanderson","Fantasy, Fiction, Audiobook, High Fantasy, Epic Fantasy, Magic, Adult, Science Fiction Fantasy, Adventure, Young Adult",4.38,"632,005 ratings","44,740 reviews","""Description contains spoilers for previous book in the series""

The impossible has been accomplished. The Lord Ruler—the man who claimed to be god incarnate and brutally ruled the world for a thousand years—has been vanquished. But Kelsier, the hero who masterminded that triumph, is dead too, and now the awesome task of building a new world has been left to his young protégé, Vin, the former street urchin who is now the most powerful Mistborn in the land, and to the idealistic young nobleman she loves.

As Kelsier's protégé and slayer of the Lord Ruler she is now venerated by a budding new religion, a distinction that makes her intensely uncomfortable. Even more worrying, the mists have begun behaving strangely since the Lord Ruler died, and seem to harbor a strange vaporous entity that haunts her.

Stopping assassins may keep Vin's Mistborn skills sharp, but it's the least of her problems. Luthadel, the largest city of the former empire, doesn't run itself, and Vin and the other members of Kelsier's crew, who lead the revolution, must learn a whole new set of practical and political skills to help. It certainly won't get easier with three armies - one of them composed of ferocious giants - now vying to conquer the city, and no sign of the Lord Ruler's hidden cache of atium, the rarest and most powerful allomantic metal.

As the siege of Luthadel tightens, an ancient legend seems to offer a glimmer of hope. But even if it really exists, no one knows where to find the Well of Ascension or what manner of power it bestows.",https://www.goodreads.com/book/show/68429.The_Well_of_Ascension
Wild Magic,"Tamora Pierce, Tamora Pierce","Fantasy, Young Adult, Fiction, Magic, Young Adult Fantasy, Adventure, High Fantasy, Dragons, Audiobook, Middle Grade",4.31,"82,639 ratings","2,686 reviews","Young Daine's knack with horses gets her a job helping the royal horsemistress drive a herd of ponies to Tortall. Soon it becomes clear that Daine's talent, as much as she struggles to hide it, is downright magical. Horses and other animals not only obey, but listen to her words. Daine, though, will have to learn to trust humans before she can come to terms with her powers, her past, and herself.",https://www.goodreads.com/book/show/13836.Wild_Magic
The Crown Conspiracy,"Michael J. Sullivan, Michael J. Sullivan","Fantasy, Fiction, Epic Fantasy, High Fantasy, Audiobook, Adventure, Magic, Science Fiction Fantasy, Adult, Young Adult",4.19,"26,260 ratings","1,620 reviews","They killed the king. They pinned it on two men. They chose poorly.

There is no ancient evil to defeat, no orphan destined for greatness, just two guys in the wrong place at the wrong time. Royce Melborn, a skilled thief, and his mercenary partner, Hadrian Blackwater make a profitable living carrying out dangerous assignments for conspiring nobles until they become the unwitting scapegoats in a plot to murder the king. Sentenced to death, they have only one way out...and so begins this tale of treachery and adventure, sword fighting and magic, myth and legend.",https://www.goodreads.com/book/show/4345290-the-crown-conspiracy
Across the Nightingale Floor,"Lian Hearn, Lian Hearn","Fantasy, Fiction, Historical Fiction, Young Adult, Japan, Historical, Romance, Adventure, Audiobook, Historical Fantasy",4.06,"45,111 ratings","2,714 reviews","In his black-walled fortress at Inuyama, the warlord Iida Sadamu surveys his famous nightingale floor. Constructed with exquisite skill, it sings at the tread of each human foot. No assassin can cross it unheard.
The youth Takeo has been brought up in a remote mountain village among the Hidden, a reclusive and spiritual people who have taught him only the ways of peace. But unbeknownst to him, his father was a celebrated assassin and a member of the Tribe, an ancient network of families with extraordinary, preternatural skills. When Takeo's village is pillaged, he is rescued and adopted by the mysterious Lord Otori Shigeru. Under the tutelage of Shigeru, he learns that he too possesses the skills of the Tribe. And, with this knowledge, he embarks on a journey that will lead him across the famed nightingale floor—and to his own unimaginable destiny...",https://www.goodreads.com/book/show/77160.Across_the_Nightingale_Floor
Dragon Wing,"Margaret Weis, Tracy Hickman, Margaret Weis","Fantasy, Fiction, Dragons, Epic Fantasy, High Fantasy, Science Fiction Fantasy, Magic, Science Fiction, Adult, Novels",3.97,"29,677 ratings",857 reviews,"Ages ago, sorcerers of unmatched power sundered a world into four realms--sky, stone, fire, and water--then vanished. Over time, magicians learned to work spells only in their own realms and forgot the others. Now only the few who have survived the Labyrinth and crossed the Death Gate know of the presence of all four realms--and even they have yet to unravel the mysteries of their severed world...

In Arianus, Realm of Sky, humans, elves, and dwarves battle for control of precious water--traversing a world of airborne islands on currents of elven magic and the backs of mammoth dragons. But soon great magical forces will begin to rend the fabric of this delicate land. An assassin will be hired to kill a royal prince--by the king himself. A dwarf will challenge the beliefs of his people--and lead them in rebellion. And a sinister wizard will enact his plan to rule Arianus--a plan that may be felt far beyond the Realm of Sky and into the Death Gate itself.",https://www.goodreads.com/book/show/28481.Dragon_Wing
Green Rider,"Kristen Britain, Kristen Britain","Fantasy, Young Adult, Fiction, High Fantasy, Magic, Adventure, Epic Fantasy, Science Fiction Fantasy, Audiobook, Adult",4.09,"40,573 ratings","2,524 reviews","Young heroine Karigan hardly has time to regret being expelled from school (for dueling) before finding herself committed to the desperate errand of a murdered Green Rider.

The Riders are an elite messenger corps using both horses and magic; the message is a terrible warning. Bad things from bad places are invading this fantasyland, their presence being only part of a devious, sorcery-aided human struggle for the throne. Karigan's wild ride is beset by a variety of enemies, but aided by her own developing talents plus certain strange allies.

These include the tormented ghost of the dead Green Rider himself--still pierced by and trying to resist the chief villain's black arrows that ensnare the soul. Delivering the message to a suspicious court is only half Karigan's job: can it be interpreted in time?",https://www.goodreads.com/book/show/147843.Green_Rider
The Diamond Throne,"David Eddings, Leigh Eddings, David Eddings","Fantasy, Fiction, Epic Fantasy, High Fantasy, Science Fiction Fantasy, Adventure, Magic, Audiobook, Young Adult, Epic",3.98,"36,378 ratings",711 reviews,"After a long spell of exile, Sparhawk, Pandion Knight and the Queen's champion returns to native land to find it overrun with evil and intrigue - and his young queen greviously ill. Indeed, Ehlana lies magically entombed within a block of crystal, doomed to die unless a cure can be found within a year.",https://www.goodreads.com/book/show/616678.The_Diamond_Throne
Rhapsody: Child of Blood,"Elizabeth Haydon, Elizabeth Haydon","Fantasy, Fiction, Epic Fantasy, High Fantasy, Romance, Science Fiction Fantasy, Magic, Adventure, Epic, Adult",3.97,"20,146 ratings",675 reviews,"The brilliant new saga is born ...

Rhapsody is a woman, a Singer of some talent, who is swept up into events of world-shattering import. On the run from an old romantic interest who won't take no for an answer, Rhapsody literally bumps into a couple of shady characters: half-breeds who come to her rescue in the nick of time. Only the rescue turns into an abduction, and Rhapsody soon finds herself dragged along on an epic voyage, one that spans centuries and ranges across a wonder-filled fantasy world-- a world so real you can hear the sweet music of Rhapsody's aubade and smell the smoldering forges deep within the Cauldron.",https://www.goodreads.com/book/show/261604.Rhapsody
Arrows of the Queen,"Mercedes Lackey, Mercedes Lackey","Fantasy, Fiction, Young Adult, High Fantasy, Magic, Science Fiction Fantasy, Adventure, Epic Fantasy, Adult, Audiobook",4.13,"39,699 ratings","1,551 reviews","Follows the adventures of Talia as she trains to become a Herald of Valdemar in the first book in the classic epic fantasy Arrows trilogy

Chosen by the Companion Rolan, a mystical horse-like being with powers beyond imagining, Talia, once a runaway, has now become a trainee Herald, destined to become one of the Queen's own elite guard. For Talia has certain awakening talents of the mind that only a Companion like Rolan can truly sense.

But as Talia struggles to master her unique abilities, time is running out. For conspiracy is brewing in Valdemar, a deadly treason that could destroy Queen and kingdom. Opposed by unknown enemies capable of both diabolical magic and treacherous assassination, the Queen must turn to Talia and the Heralds for aid in protecting the realm and insuring the future of the Queen's heir, a child already in danger of becoming bespelled by the Queen's own foes.",https://www.goodreads.com/book/show/13986.Arrows_of_the_Queen
The Three Witches and The Master,"Max Nowaz, Max Nowaz","Fiction, Novels, Adventure, Science Fiction Fantasy, Fantasy, High Fantasy, Magic, Epic, Speculative Fiction, Epic Fantasy",4.30,"17,963 ratings",25 reviews,"When a beautiful naked woman Eve, unexpectedly turns up at his back door, Adam, an amateur wizard, is not sure if it is his good fortune or not. The young woman has an attitude and starts bossing him around straightaway, issuing commands; which strikes Adam that she may be a practitioner of the black arts.
Adam, who has been dabbling with spells from a book he has found in the basement of a derelict house, decides to play along with her until he learns more. Adam soon discovers that she is a witch, and she somehow, has been transported from the 1950s to the present day.
Meanwhile, he has been having some terrible nightmares. A being, who calls himself The Master is haunting him and is after his book of magic. In recurring dreams, Adam meets his demise several times in the Master’s hands and is unable to find a way to escape him.
Adam can’t tell if Eve is going to turn out to be his friend or a foe and tries to keep his own abilities a secret from her. He is also hiding another terrible secret from her, which he knows will have to come out sooner or later. Meanwhile, his worst nightmare is about to come true as the Master turns out to be real. Adam is in a fight for his very survival and is not sure if he can win. All the time he also has to maintain the semblance of normality in his hectic, day-to-day very stressful life, which is also about to fall apart as the police are out to get him for something they suspect he has done.
The book is a dark-humoured, fast-paced, fun Urban fantasy thriller.",https://www.goodreads.com/book/show/208051245-the-three-witches-and-the-master
The Way of Shadows,"Brent Weeks, Brent Weeks","Fantasy, Fiction, Epic Fantasy, High Fantasy, Magic, Audiobook, Adventure, Adult, Dark Fantasy, Science Fiction Fantasy",4.15,"175,911 ratings","6,425 reviews","From New York Times Bestselling author Brent Weeks...
For Durzo Blint, assassination is an art-and he is the city's most accomplished artist.

For Azoth, survival is precarious. Something you never take for granted. As a guild rat, he's grown up in the slums, and learned to judge people quickly - and to take risks. Risks like apprenticing himself to Durzo Blint.

But to be accepted, Azoth must turn his back on his old life and embrace a new identity and name. As Kylar Stern, he must learn to navigate the assassins' world of dangerous politics and strange magics - and cultivate a flair for death.",https://www.goodreads.com/book/show/3227063-the-way-of-shadows
Viciously Yours,"Jamie Applegate Hunter, Jamie Applegate Hunter","Fantasy, Romance, Romantasy, Fae, Fantasy Romance, Magic, Fiction, Dark Romance, High Fantasy, Adventure",3.60,"42,834 ratings","5,102 reviews","""I don't need a line to know what's considered good or bad, but if I did, there isn't a line I wouldn't cross for you.""

When Rennick was thirteen, the gods bestowed upon him the name of his fated mate--a human girl. As the sole heir to the Mountain Kingdom, magic bound him to his kingdom until he ascended the throne on his twenty-fifth birthday, and as a human, she couldn't cross the magical barrier separating the humans from the fae. Heartsore and consumed with thoughts of her, he did the only thing he could and sent her anonymous letters and gifts…

Until he crossed the barrier into her kingdom to claim her as his own.


Six months after Amelia's thirteenth birthday, she received a strange letter from a fae boy claiming her as his mate. Humans weren't taught much about the fae, and one look at the horrifying doll meant to be her belated birthday gift solidified her suspicions that someone was playing a cruel joke. Except the letters and odd gifts kept coming. Against her better judgment, Amelia fell in love with her mysterious admirer throughout the years, certain they would never meet. But on her twenty-fifth birthday, her walk to work was interrupted by two familiar words she'd read a million times.

""Hello, love.""

Viciously Yours is a new adult fantasy romance long novella/short novel of about 60k words/250 pages. It is fast-paced and focuses solely on the relationship between the two main characters. There is no overarching background plot. Example: Rebels attack the kingdoms, but there is no story as to why because it just is.

The couple does have minor obstacles, but there is no miscommunication trope, no third act breakup, and no cheating.

PLEASE NOTE: The male main character does a few morally black things to those he deems a threat to his relationship. There are no shades of grey.

CONTENT WARNINGS:
Orphaned heroine, gore, unethical kills and decisions by main characters, death of a parent, mature language, explicit sexual situations, graphic violence and death",https://www.goodreads.com/book/show/205404157-viciously-yours
