Title,Author,Genres,Avg_Rating,Num_Ratings,Num_Reviews,Description,Book_URL
The Penguin History of New Zealand,"Michael King, Michael King","History, Nonfiction, Travel, Audiobook, Historical, Reference, 21st Century, Unfinished, Asia, Politics",4.13,"2,362 ratings",242 reviews,"New Zealand was the last country in the world to be discovered and settled by humankind. It was also the first to introduce a full democracy. Between those events, and in the century that followed the franchise, the movements and the conflicts of human history have been played out more intensively and more rapidly in New Zealand than anywhere else on Earth. This title tells that story in all its colour and drama. The narrative that emerges is an inclusive one about men and women, Maori and Pakeha. It shows that British motives in colonizing New Zealand were essentially humane; and that Maori, far from being passive victims of a ""fatal impact"", coped heroically with colonization and survived by selectively accepting and adapting what Western technology and culture had to offer. The latter part of the book reveals how an insulated and dependent British colony transformed itself into an independent nation, open to and competing with technological and cultural influences sweeping the globe.",https://www.goodreads.com/book/show/108780.The_Penguin_History_of_New_Zealand
"The Year 1000: What Life Was Like at the Turn of the First Millennium, An Englishman's World","Robert Lacey, Robert Lacey","History, Nonfiction, Medieval, Historical, Medieval History, British Literature, European History, Reference, World History, Anthropology",3.87,"5,853 ratings",569 reviews,"As the Shadow of the Millennium Descended Across England and Christendom, it Seemed as if the World was About to End. Actually, it was Only the Beginning... Welcome to the Year 1000. This is What Life was Like. How clothes were fastened in a world without buttons, p.10 The rudiments of medieval brain surgery, p.124 The first millennium's Bill Gates, p.192 How dolphins forecasted weather, p.140 The recipe for a medieval form of Viagra, p.126 Body parts a married woman had to forfeit if she committed adultery, p.171 The fundamental rules of warfare, p.154 How fried and crushed black snails could improve your health, p.127 And much more...",https://www.goodreads.com/book/show/55139.The_Year_1000
MICHAEL COLLINS: The Man Who Made Ireland,"Tim Pat Coogan, Tim Pat Coogan","History, Biography, Ireland, Nonfiction, Irish Literature, Politics, Historical, Biography Memoir, European History, War",4.07,"2,024 ratings",95 reviews,"When the Irish nationalist Michael Collins signed the Anglo-Irish Treaty in December 1921, he observed to Lord Birkenhead that he may have signed his own death warrant. In August 1922 that prophecy came true when Collins was ambushed, shot and killed by a compatriot, but his vision and legacy lived on. Tim Pat Coogan's biography presents the life of a man whose idealistic vigor and determination were matched by his political realism and organizational abilities. This is the classic biography of the man who created modern Ireland.",https://www.goodreads.com/book/show/416407.MICHAEL_COLLINS
The Ascent of Money: A Financial History of the World,"Niall Ferguson, Niall Ferguson","History, Economics, Nonfiction, Finance, Business, Money, Politics, Audiobook, World History, Historical",3.90,"30,471 ratings","1,988 reviews","Niall Ferguson follows the money to tell the human story behind the evolution of finance, from its origins in ancient Mesopotamia to the latest upheavals on what he calls Planet Finance. Bread, cash, dosh, dough, loot, lucre, moolah, readies, the wherewithal: Call it what you like, it matters. To Christians, love of it is the root of all evil. To generals, it’s the sinews of war. To revolutionaries, it’s the chains of labor. But in The Ascent of Money, Niall Ferguson shows that finance is in fact the foundation of human progress. What’s more, he reveals financial history as the essential backstory behind all history. With the clarity and verve for which he is known, Ferguson elucidates key financial institutions and concepts by showing where they came from. What is money? What do banks do? What’s the difference between a stock and a bond? Why buy insurance or real estate? And what exactly does a hedge fund do? This is history for the present. Ferguson travels to post-Katrina New Orleans to ask why the free market can’t provide adequate protection against catastrophe. He delves into the origins of the subprime mortgage crisis.",https://www.goodreads.com/book/show/2714607-the-ascent-of-money
Forty-Ninth,"Boris Pronsky, Craig Britton, Yasen Denev, Boris Pronsky","Historical Fiction, Novels, Fiction, Audiobook, American History, Historical, Russian History, 19th Century, Adventure, Literature",4.10,130 ratings,12 reviews,"A novel about one of the largest land deals in history, the Alaska purchase.

In 1866, an assassination attempt against Alexander II unfolds a series of events that coerce him into selling Alaska to the United States an year later. Meanwhile, Native Alaskans are stuck between the changing order. Some try to fit in while others attempt to fight back. Further south, in a deeply polarized post-Civil War America, the plans of President Johnson conflict with his Security of State’s ambition to acquire Alaska. An approaching impeachment pressures Johnson to attempt to sabotage the deal. Behind closed doors, however, a powerful banking family is awaiting a long overdue payment from the Russians, but there is only so much gold to go around.",https://www.goodreads.com/book/show/58937530-forty-ninth
The Daughter of Kurdland: A Life Dedicated to Humankind,"Widad Akreyi, Widad Akreyi","History, Nonfiction, Memoir, Biography, Politics, Middle East, Sociology, Social Issues, Feminism, Science",4.20,410 ratings,10 reviews,"WINNER of the PACEM IN TERRIS PEACE AND FREEDOM AWARD

The Kurdish activist who became a global icon

A powerful portrayal of a little school girl who defies Saddam Hussein's regime, survives Anfal Genocide and goes on to become an award-winning champion for human rights.

By combining crisp prose with utterly enthralling storytelling, Widad pulls back the curtain to reveal in vivid detail and with unflinching honesty the experiences that have shaped her — from her childhood in Kurdistan region where she was doomed to persecution, to her years as a university student undertaking the grueling task of chronicling crimes against humanity when she was just 17 years old, to her phenomenal resilience in exile. The Daughter of Kurdland takes the reader on an intimate journey to uncover deep truths that are valid in any age but especially so in our present context. Sparkling with wit and wisdom, this book poses universal questions: Should we always do what others tell us to do? How important is it to defy norms? How much of ourselves should we be willing to compromise for the sake of others? And how much should we be prepared to pay?

A profile in courage, Widad is today an international icon for peace and women empowerment, and is the youngest winner of the Pacem in Terris Peace and Freedom Award, ranked among world-renowned figures like John F. Kennedy, Mother Teresa, Desmond Tutu and Dalai Lama. A testament to the power of human endurance, The Daughter of Kurdland will inspire and surprise men and women alike.",https://www.goodreads.com/book/show/55506538-the-daughter-of-kurdland
Zoroastrians' Fight for Survival,"Widad Akreyi, Widad Akreyi","Historical Fiction, Historical",4.69,118 ratings,8 reviews,"An epic tale of romance and reminiscence. A meeting of hearts in the most unlikely of circumstance!

A woman with a dazzling mind. A man makes impulsive decisions. A royal wedding turns into beheading, a nation at risk of annihilation, and a battle for survival is on the horizon.

Two vikings – one of whom is the formidable former Varangian Guard whose name is carved on a marble slab in Constantinople's Hagia Sophia – settle down in Kurdland. Though defined by the different opportunities and challenges imposed on them, Ivar and Halvdan are both desperate for recognition and affection. As their lives intertwine with the enchanting and virtuous doctor, Vesta, the successful Palace manager, Zara, and the newly coronated Kurdish King, Saaid, they try to deal with the inevitable trials of love and loss at a time when uncertainty continues to cloud their future.

Well-researched and seductively charming, The Viking's Kurdish Love spans across continents, cultures, religions and decades of tumultuous regional and global history. Widad's lyrical prose sensuously wraps the readers in the story of how the people of the era refuse to be trapped by their past experiences.",https://www.goodreads.com/book/show/57550531-zoroastrians-fight-for-survival
The Last Battle: The Classic History of the Battle for Berlin,"Cornelius Ryan, Cornelius Ryan","History, Nonfiction, World War II, War, Military History, Military Fiction, Germany, Audiobook, European History, Historical",4.25,"7,048 ratings",259 reviews,"The classic account of the final offensive against Hitler's Third Reich.

The Battle for Berlin was the culminating struggle of World War II in the European theater, the last offensive against Hitler's Third Reich, which devastated one of Europe's historic capitals and marked the final defeat of Nazi Germany. It was also one of the war's bloodiest and most pivotal battles, whose outcome would shape international politics for decades to come.

Cornelius Ryan's compelling account of this final battle is a story of brutal extremes, of stunning military triumph alongside the stark conditions that the civilians of Berlin experienced in the face of the Allied assault. As always, Ryan delves beneath the military and political forces that were dictating events to explore the more immediate imperatives of survival, where, as the author describes it, “to eat had become more important than to love, to burrow more dignified than to fight, to exist more militarily correct than to win.”

It is the story of ordinary people, both soldiers and civilians, caught up in the despair, frustration, and terror of defeat. It is history at its best, a masterful illumination of the effects of war on the lives of individuals, and one of the enduring works on World War II.",https://www.goodreads.com/book/show/84370.The_Last_Battle
The Civilization of the Renaissance in Italy,"Jacob Burckhardt, S.G.C. Middlemore, Peter Burke, Jacob Burckhardt","History, Renaissance, Nonfiction, Art, Italy, Classics, Art History",3.93,"3,180 ratings",162 reviews,"For nineteenth-century Swiss historian Jacob Burckhardt, the Italian Renaissance was nothing less than the beginning of the modern world - a world in which flourishing individualism and the competition for fame radically transformed science, the arts, and politics. In this landmark work he depicts the Italian city-states of Florence, Venice and Rome as providing the seeds of a new form of society, and traces the rise of the creative individual, from Dante to Michelangelo. A fascinating description of an era of cultural transition, this nineteenth-century masterpiece was to become the most influential interpretation of the Italian Renaissance, and anticipated ideas such as Nietzsche's concept of the 'Ubermensch' in its portrayal of an age of genius.",https://www.goodreads.com/book/show/1041033.The_Civilization_of_the_Renaissance_in_Italy
"The Triumph of Improvisation: Gorbachev's Adaptability, Reagan's Engagement, and the End of the Cold War","James Graham Wilson, James Graham Wilson","History, Politics, Nonfiction, Russia, American History, Russian History",3.62,110 ratings,9 reviews,"In The Triumph of Improvisation, James Graham Wilson takes a long view of the end of the Cold War, from the Soviet invasion of Afghanistan in December 1979 to Operation Desert Storm in January 1991. Drawing on deep archival research and recently declassified papers, Wilson argues that adaptation, improvisation, and engagement by individuals in positions of power ended the specter of a nuclear holocaust. Amid ambivalence and uncertainty, Mikhail Gorbachev, Ronald Reagan, George Shultz, George H. W. Bush, and a host of other actors engaged with adversaries and adapted to a rapidly changing international environment and information age in which global capitalism recovered as command economies failed.

Eschewing the notion of a coherent grand strategy to end the Cold War, Wilson paints a vivid portrait of how leaders made choices; some made poor choices while others reacted prudently, imaginatively, and courageously to events they did not foresee. A book about the burdens of responsibility, the obstacles of domestic politics, and the human qualities of leadership, The Triumph of Improvisation concludes with a chapter describing how George H. W. Bush oversaw the construction of a new configuration of power after the fall of the Berlin Wall, one that resolved the fundamental components of the Cold War on Washington's terms.",https://www.goodreads.com/book/show/18763135-the-triumph-of-improvisation
"Understanding China: Learning from China's Past, Present, and Future","Stefan Piech, Stefan Piech","China, Politics, History, Economics, Current Affairs, Nonfiction, Asia",3.92,63 ratings,10 reviews,"China is quickly proving to be an important global player. Acknowledging its inevitable growth, understanding China has become as important as ever. Over the last decade, we have witnessed Chinese businesses expand outside the country's borders and how China’s influence is spreading around the globe. This might leave some Is China's success due to Deng Xiaoping’s opening-up policy or is there something else that can be credited? In this book, Stefan Piech takes the reader on a journey through China’s history, present, and future to answer this exact question. While Chinese society is now infused with innovation and dynamism, America has seen the foundations of its economic model shake after the 2008 financial crisis. With the global rise of China, the US is now facing a political challenge that it has never seen before. As a consequence of this, politicians and business leaders all around the world have an increased interest in understanding China. At the end of the day, it seems possible that China will replace the United States as the world's dominant power. In doing so, it will not become more western but the world will become more Chinese. Consequently, it is important for us to understand this rising power not through western terms but through its own unique history and culture. “Probably in 2035 we will pass that mantle on to China. It will be the biggest economy in the world, and it will go way past us and way past India. Given the growth, the size, the opportunities, I don’t think there’s any other place in the world that can match it.” – David Rubenstein",https://www.goodreads.com/book/show/55692678-understanding-china
Founding Mothers: The Women Who Raised Our Nation,"Cokie Roberts, Cokie Roberts","History, Nonfiction, Biography, American History, Book Club, Historical, American Revolution, Audiobook, Womens, Feminism",3.64,"8,911 ratings","1,478 reviews","From #1 New York Times bestselling author Cokie Roberts comes New York Times bestseller Founding Mothers, an intimate and illuminating look at the fervently patriotic and passionate women whose tireless pursuits on behalf of their families–and their country–proved just as crucial to the forging of a new nation as the rebellion that established it.

While much has been written about the men who signed the Declaration of Independence, battled the British, and framed the Constitution, the wives, mothers, sisters and daughters they left behind have been little noticed by history. #1 New York Times bestselling author Cokie Roberts brings us women who fought the Revolution as valiantly as the men, often defending their very doorsteps. Drawing upon personal correspondence, private journals, and even favoured recipes, Roberts reveals the often surprising stories of these fascinating women, bringing to life the everyday trials and extraordinary triumphs of individuals like Abigail Adams, Mercy Otis Warren, Deborah Read Franklin, Eliza Pinckney, Catherine Littlefield Green, Esther DeBerdt Reed and Martha Washington–proving that without our exemplary women, the new country might have never survived.",https://www.goodreads.com/book/show/85665.Founding_Mothers
The Fate of Africa: A History of Fifty Years of Independence,"Martin Meredith, Martin Meredith","History, Africa, Nonfiction, Politics, World History, Economics, Travel, International Relations, Historical, Reference",4.20,"7,406 ratings",587 reviews,"""The fortunes of Africa have changed dramatically in the fifty years since the independence era began. As Europe's colonial powers withdrew, dozens of new states were launched amid much jubilation and to the world's applause. African leaders stepped forward with energy and enthusiasm to tackle the problems of development and nation-building, boldly proclaiming their hopes of establishing new societies that might offer inspiration to the world at large. The circumstances seemed auspicious. Independence came in the midst of an economic boom. On the world stage, African states excited the attention of the world's rival power blocs; in the Cold War era, the position that each newly independent state adopted in its relations with the West or the East was viewed as a matter of crucial importance. Africa was considered too valuable a prize to lose."" ""Today, Africa is spoken of only in pessimistic terms. The sum of its misfortunes - its wars, its despotisms, its corruption, its droughts - is truly daunting. No other area of the world arouses such a sense of foreboding. Few states have managed to escape the downward spiral: Botswana stands out as a unique example of an enduring multi-party democracy; South Africa, after narrowly avoiding revolution, has emerged in the post-apartheid era as a well-managed democratic state. But most African countries are effectively bankrupt, prone to civil strife, subject to dictatorial rule, weighted down by debt, and heavily dependent on Western assistance for survival."" ""So what went wrong? What happened to this vast continent, so rich in resources, culture and history, to bring it so close to destitution and despair in the space of two generations?"" Focusing on the key personalities, events and themes of the independence era, Martin Meredith's narrative history seeks to explore and explain the myriad problems that Africa has faced in the past half-century, and faces still. The Fate of Africa is essential reading for anyone seeking to understand how it came to this — and what, if anything, is to be done.",https://www.goodreads.com/book/show/185540.The_Fate_of_Africa
The Pirate Hunter: The True Story of Captain Kidd,"Richard Zacks, Richard Zacks","History, Nonfiction, Pirates, Biography, Adventure, Historical, Nautical, Audiobook, Crime, American History",3.84,"2,676 ratings",245 reviews,"Everybody knows the legend of Captain Kidd, America's most ruthless buccanneer. Few people realize that the facts of his life make for a much better tale. Kidd was actually a tough New York sea captain hired to chase pirates, a married war hero whose secret mission took a spectacularly bad turn.

This harrowing tale traces Kidd's voyages in the 1690s from his home near Wall Street to Whitehall Palace in London, from the ports of the Caribbean to a secret pirate paradise off Madagascar. Author Richard Zacks, during his research, also unearthed the story of a long forgotten rogue named Robert Culliford, who dogged Kidd and led Kidd's crew to mutiny not once but twice. The lives of Kidd and Culliford play out like an unscripted one man would hang in the harbor, the other would walk away with the treasure. Filled with superb writing and impeccable research, The Pirate Hunter is both a masterpiece of historical detective work and a ripping good yarn, and it delivers something an authentic pirate story for grown-ups.",https://www.goodreads.com/book/show/143718.The_Pirate_Hunter
Lone Survivor: The Eyewitness Account of Operation Redwing and the Lost Heroes of SEAL Team 10,"Marcus Luttrell, Patrick Robinson, Marcus Luttrell","Nonfiction, Military Fiction, History, War, Biography, Memoir, Military History, Book Club, Audiobook, Autobiography",4.34,"99,981 ratings","7,570 reviews","On a clear night in late June 2005, four U.S. Navy SEALs left their base in northern Afghanistan for the mountainous Pakistani border. Their mission was to capture or kill a notorious al Qaeda leader known to be ensconced in a Taliban stronghold surrounded by a small but heavily armed force. Less then twenty-four hours later, only one of those Navy SEALs remained alive.


This is the story of fire team leader Marcus Luttrell, the sole survivor of Operation Redwing, and the desperate battle in the mountains that led, ultimately, to the largest loss of life in Navy SEAL history. But it is also, more than anything, the story of his teammates, who fought ferociously beside him until he was the last one left-blasted unconscious by a rocket grenade, blown over a cliff, but still armed and still breathing. Over the next four days, badly injured and presumed dead, Luttrell fought off six al Qaeda assassins who were sent to finish him, then crawled for seven miles through the mountains before he was taken in by a Pashtun tribe, who risked everything to protect him from the encircling Taliban killers.


A six-foot-five-inch Texan, Leading Petty Officer Luttrell takes us, blow-by-blow, through the brutal training of America's warrior elite and the relentless rites of passage required by the Navy SEALs. He transports us to a monstrous battle fought in the desolate peaks of Afghanistan, where the beleaguered American team plummeted headlong a thousand feet down a mountain as they fought back through flying shale and rocks. In this rich , moving chronicle of courage, honor, and patriotism, Marcus Luttrell delivers one of the most powerful narratives ever written about modern warfare-and a tribute to his teammates, who made the ultimate sacrifice for their country.",https://www.goodreads.com/book/show/711901.Lone_Survivor
Augustus: The Life of Rome's First Emperor,"Anthony Everitt, Anthony Everitt","History, Biography, Nonfiction, Ancient History, Historical, Biography Memoir, Audiobook, Ancient, Roman, Italy",3.95,"8,286 ratings",479 reviews,"He found Rome made of clay and left it made of marble. As Rome’s first emperor, Augustus transformed the unruly Republic into the greatest empire the world had ever seen. His consolidation and expansion of Roman power two thousand years ago laid the foundations, for all of Western history to follow. Yet, despite Augustus’s accomplishments, very few biographers have concentrated on the man himself, instead choosing to chronicle the age in which he lived. Here, Anthony Everitt, the bestselling author of Cicero, gives a spellbinding and intimate account of his illustrious subject.

Augustus began his career as an inexperienced teenager plucked from his studies to take center stage in the drama of Roman politics, assisted by two school friends, Agrippa and Maecenas. Augustus’s rise to power began with the assassination of his great-uncle and adoptive father, Julius Caesar, and culminated in the titanic duel with Mark Antony and Cleopatra.
The world that made Augustus–and that he himself later remade–was driven by intrigue, sex, ceremony, violence, scandal, and naked ambition. Everitt has taken some of the household names of history–Caesar, Brutus, Cassius, Antony, Cleopatra–whom few know the full truth about, and turned them into flesh-and-blood human beings.

At a time when many consider America an empire, this stunning portrait of the greatest emperor who ever lived makes for enlightening and engrossing reading. Everitt brings to life the world of a giant, rendered faithfully and sympathetically in human scale. A study of power and political genius, Augustusis a vivid, compelling biography of one of the most important rulers in history.",https://www.goodreads.com/book/show/89230.Augustus
Diplomacy,"Henry Kissinger, Henry Kissinger","History, Politics, Nonfiction, International Relations, Political Science, World History, Philosophy, American History, War, International Affairs",4.25,"9,324 ratings",586 reviews,"A brilliant, sweeping history of diplomacy that includes personal stories from the noted former Secretary of State, including his stunning reopening of relations with China.

The seminal work on foreign policy and the art of diplomacy.

Moving from a sweeping overview of history to blow-by-blow accounts of his negotiations with world leaders, Henry Kissinger describes how the art of diplomacy has created the world in which we live, and how America’s approach to foreign affairs has always differed vastly from that of other nations.

Brilliant, controversial, and profoundly incisive, Diplomacy stands as the culmination of a lifetime of diplomatic service and scholarship. It is vital reading for anyone concerned with the forces that have shaped our world today and will impact upon it tomorrow.",https://www.goodreads.com/book/show/781183.Diplomacy
