Title,Author,Genres,Avg_Rating,Num_Ratings,Num_Reviews,Description,Book_URL
All the Countries: And the Few We Never Got Round To,"Stuart Laycock, Stuart Laycock","History, Nonfiction, War, Politics, Historical, European History, Military Fiction, British Literature, World History, Humor",3.73,733 ratings,66 reviews,"Packed with thought-provoking and intriguing facts, an entertaining look at the UK's imperial past as you've never seen it before 

Out of 193 countries that are currently UN member states, the UK has invaded or fought conflicts in the territory of 171. That’s not far off a massive, jaw-dropping 90 percent. Not too many Britons know that the UK invaded Iran in World War II with the Soviets. You can be fairly sure a lot more Iranians do. Or what about the time they arrived with elephants to invade Ethiopia? Every summer, hordes of British tourists now occupy Corfu and the other Ionian islands. Find out how they first invaded them armed with cannons instead of cameras and set up the United States of the Ionian Islands. Think the Philippines have always been outside their zone of influence? Think again. Read the surprising story of their 18th century occupation of Manila and how they demanded a ransom of millions of dollars for the city. This book takes a look at some of the truly awe-inspiring ways the UK has been a force, for good and for bad, right across the world. A lot of people are vaguely aware that a quarter of the globe was once pink, but that’s not even half the story. They're a dynamic and irrepressible nation, and this is how they changed the world, often when it didn't ask to be changed!",https://www.goodreads.com/book/show/18595518-all-the-countries
Destiny Disrupted: A History of the World Through Islamic Eyes,"Tamim Ansary, Tamim Ansary","History, Nonfiction, Islam, Religion, Middle East, Politics, World History, Audiobook, Historical, Asia",4.40,"12,310 ratings","1,616 reviews","We in the west share a common narrative of world history. But our story largely omits a whole civilization whose citizens shared an entirely different narrative for a thousand years.

In Destiny Disrupted, Tamim Ansary tells the rich story of world history as the Islamic world saw it, from the time of Mohammed to the fall of the Ottoman Empire and beyond. He clarifies why our civilizations grew up oblivious to each other, what happened when they intersected, and how the Islamic world was affected by its slow recognition that Europe-a place it long perceived as primitive and disorganized-had somehow hijacked destiny.",https://www.goodreads.com/book/show/34617904-destiny-disrupted
Paul Revere's Ride,"David Hackett Fischer, David Hackett Fischer","History, Poetry, American History, American Revolution, Nonfiction, Biography, Classics, Picture Books, American Revolutionary War, Childrens",4.14,"7,903 ratings",512 reviews,"Paul Revere's midnight ride is a legendary event in American history - yet it has been largely ignored by scholars, and left to patriotic writers and debunkers. Now one of the foremost American historians offers the first serious study of this event - what led to it, what really happened, what followed - uncovering a truth more remarkable than the many myths it has inspired. In Paul Revere's Ride, David Hackett Fischer has created an exciting narrative that offers new insight into the coming of the American Revolution. From research in British and American archives, the author unravels a plot that no novelist would dare invent - a true story of high drama and deep suspense, of old-fashioned heroes and unvarnished villains, of a beautiful American spy who betrayed her aristocratic British husband, of violent mobs and marching armies, of brave men dying on their doorsteps, of high courage, desperate fear, and the destiny of nations. The narrative is constructed around two thematic lines. One story centers on the American patriot Paul Revere; the other, on British General Thomas Gage. Both were men of high principle who played larger roles than recent historiography has recognized. Thomas Gage was not the Tory tyrant of patriot legend, but an English Whig who believed in liberty and the rule of law. In 1774 and 1775, General Gage's advice shaped the fatal choices of British leaders, and his actions guided the course of American events. Paul Revere was more than a ""simple artizan, "" as his most recent biographer described him fifty years ago. The author presents new evidence that revolutionary Boston was a world of many circles - more complex than we have known. Paul Revere and his friend Joseph Warren ranged more widely through those circles than any other leaders. They became the linchpins of the Whig movement. On April 18th, 1775, Paul Revere played that role in a manner that has never been told before. He and William Dawes were not the only midnight riders to ca",https://www.goodreads.com/book/show/32080.Paul_Revere_s_Ride
The Great Game: The Struggle for Empire in Central Asia,"Peter Hopkirk, Peter Hopkirk","History, Nonfiction, Russia, Asia, Politics, India, World History, Espionage, War, Historical",4.33,"8,967 ratings",815 reviews,"For nearly a century the two most powerful nations on earth - Victorian Britain and Tsarist Russia - fought a secret war in the lonely passes and deserts of Central Asia. Those engaged in this shadowy struggle called it 'The Great Game', a phrase immortalized in Kipling's Kim.
When play first began the two rival empires lay nearly 2,000 miles apart. By the end, some Russian outposts were within 20 miles of India.

This book tells the story of the Great Game through the exploits of the young officers, both British and Russian, who risked their lives playing it. Disguised as holy men or native horsetraders, they mapped secret passes, gathered intelligence, and sought the allegiance of powerful khans. Some never returned.",https://www.goodreads.com/book/show/138299.The_Great_Game
To Overthrow the World: The Rise and Fall and Rise of Communism,"Sean McMeekin, Sean McMeekin","History, Politics, Nonfiction, Russia, Philosophy, China, Sociology, War, Economics, Political Science",4.10,367 ratings,38 reviews,"From an award-winning historian, a new global history of Communism  When the USSR collapsed in 1991, the world was certain that Communism was dead. Today, three decades later, it is clear that it was not. While Russia may no longer be Communist, Communism and sympathy for Communist ideas have proliferated across the globe.    In To Overthrow the World, Sean McMeekin investigates the evolution of Communism from a seductive ideal of a classless society into the ruling doctrine of tyrannical regimes. Tracing Communism’s ascent from theory to practice, McMeekin ranges from Karl Marx’s writings to the rise and fall of the USSR under Stalin to Mao’s rise to power in China to the acceleration of Communist or Communist-inspired policies around the world in the twenty-first century. McMeekin argues, however, that despite the endurance of Communism, it remains deeply unpopular as a political form. Where it has arisen, it has always arisen by force.    Blending historical narrative with cutting-edge scholarship, To Overthrow the World revolutionizes our understanding of the evolution of Communism—an idea that seemingly cannot die.",https://www.goodreads.com/book/show/204593674-to-overthrow-the-world
The Crusades: The Authoritative History of the War for the Holy Land,"Thomas Asbridge, Thomas Asbridge","History, Nonfiction, Religion, Medieval, War, Medieval History, European History, World History, Middle East, Audiobook",4.23,"6,872 ratings",665 reviews,"The Crusades is an authoritative, accessible single-volume history of the brutal struggle for the Holy Land in the Middle Ages. Thomas Asbridge—a renowned historian who writes with “maximum vividness” (Joan Acocella, The New Yorker )—covers the years 1095 to 1291 in this  big, ambitious, readable account of one of the most fascinating periods in history. From Richard the Lionheart to the mighty Saladin, from the emperors of Byzantium to the Knights Templar, Asbridge’s book is a magnificent epic of Holy War between the Christian and Islamic worlds, full of adventure, intrigue, and sweeping grandeur .",https://www.goodreads.com/book/show/7282903-the-crusades
The Discoverers: A History of Man's Search to Know His World and Himself,"Daniel J. Boorstin, Daniel J. Boorstin","History, Nonfiction, Science, Philosophy, World History, History Of Science, Historical, Biography, Geography, Adventure",4.11,"11,816 ratings",395 reviews,An original history of man's greatest adventure: his search to discover the world around him.,https://www.goodreads.com/book/show/714380.The_Discoverers
Operation Mincemeat: How a Dead Man and a Bizarre Plan Fooled the Nazis and Assured an Allied Victory,"Ben Macintyre, Ben Macintyre","History, Nonfiction, World War II, War, Espionage, Audiobook, Military Fiction, Historical, Military History, Biography",4.03,"23,056 ratings","2,029 reviews","In 1943, from a windowless London basement office, two intelligence officers conceived a plan that was both simple & complicated—Operation Mincemeat. Purpose? To deceive the Nazis into thinking the Allies were planning to attack Europe by way of Greece or Sardinia, rather than Sicily, as the Nazis had assumed & the Allies ultimately chose. Charles Cholmondeley of MI5 and the British naval intelligence officer Ewen Montagu were very different. Cholmondeley was a dreamer seeking adventure. Montagu was an aristocratic, detail-oriented barrister. A perfect team, they created an ingenious plan: equip a corpse with secret (but false) papers concerning the invasion, then drop it off the coast of Spain where German spies would hopefully take the bait. The idea was approved by British intelligence officials, including Ian Fleming (007's creator). Winston Churchill believed it might ring true to the Axis & help bring victory.",https://www.goodreads.com/book/show/7632329-operation-mincemeat
On Sparta,"Plutarch, Richard J.A. Talbert, Christopher Pelling, Plutarch","History, Classics, Nonfiction, Ancient History, Philosophy, Biography, Ancient, Greece, War, Historical",4.12,"1,974 ratings",88 reviews,"Plutarch's vivid and engaging portraits of the Spartans and their customs are a major source of our knowledge about the rise and fall of this remarkable Greek city-state between the sixth and third centuries BC. Through his Lives of Sparta's leaders and his recording of memorable Spartan Sayings he depicts a people who lived frugally and mastered their emotions in all aspects of life, who also disposed of unhealthy babies in a deep chasm, introduced a gruelling regime of military training for boys, and treated their serfs brutally. Rich in anecdote and detail, Plutarch's writing brings to life the personalities and achievements of Sparta with unparalleled flair and humanity.

Lives: Lycurgus, Agesilaus, Agis, Cleomenes.
Sayings: sayings of Spartans, sayings of Spartan Women.
Appendix: Xenephon: Spartan Society",https://www.goodreads.com/book/show/443095.On_Sparta
The Wives of Henry VIII,"Antonia Fraser, Antonia Fraser","History, Nonfiction, Biography, Tudor Period, Historical, British Literature, Royalty, Biography Memoir, European History, 16th Century",4.11,"19,090 ratings",542 reviews,"In a sweeping narrative, Fraser traces the cultural, familial and political roots of each of Henry's queens, pushes aside the stereotypes that have long defined them, and illuminates the complex character of each. The result is a superb work of history through which these six women become as memorable for their own achievements--and mistakes--as they have always been for their fateful link to Henry VIII. Illustrations.",https://www.goodreads.com/book/show/530793.The_Wives_of_Henry_VIII
The 900 Days: The Siege of Leningrad,"Harrison E. Salisbury, Harrison E. Salisbury","History, Nonfiction, Russia, War, World War II, Military History, Russian History, Military Fiction, Historical, European History",4.18,"3,859 ratings",202 reviews,"The Nazi siege of Leningrad from 1941 to 1944 was one of the most gruesome battles of World War II. Nearly three million people endured it; just under half of them died. For twenty-five years the distinguished journalist and historian Harrison Salisbury pieced together this remarkable narrative of villainy and survival, in which the city had much to fear-from both Hitler and Stalin.",https://www.goodreads.com/book/show/248510.The_900_Days
Inside the Third Reich,"Albert Speer, Albert Speer","History, Nonfiction, Biography, World War II, War, Memoir, Germany, Politics, Autobiography, Holocaust",4.10,"14,250 ratings",524 reviews,"Written by Hitler's Minister of Armaments and War Production, the man who kept Germany armed and the war machine running even after Hitler's mystique had faded, this memoir gives us as complete a view as we will ever get of the inside of the Nazi state. B&W photos.",https://www.goodreads.com/book/show/853201.Inside_the_Third_Reich
"The History of Rome, Books 1-5: The Early History of Rome","Livy, Aubrey de Sélincourt, Robert Maxwell Ogilvie, Livy","History, Classics, Nonfiction, Ancient History, Roman, Ancient, School",3.96,"9,821 ratings",333 reviews,"Livy (c. 59 BC-AD 17) dedicated most of his life to writing some 142 volumes of history, the first five of which comprise The Early History of Rome. With stylistic brilliance, he chronicles nearly 400 years of history, from the founding of Rome (traditionally dated to 757 BC) to the Gallic invasion in 386 BC - an era which witnessed the reign of seven kings, the establishment of the Republic, civil strife and brutal conflict. Bringing compelling characters to life, and re-presenting familiar tales - including the tragedy of Coriolanus and the story of Romulus and Remus - The Early History is a truly epic work, and a passionate warning that Rome should learn from its history.",https://www.goodreads.com/book/show/68542.The_History_of_Rome_Books_1_5
Medieval Civilization 400-1500,"Jacques Le Goff, Julia Barrow, Jacques Le Goff","History, Nonfiction, Medieval, Medieval History, France, European History, Art, World History, Reference, Academic",4.16,"1,183 ratings",64 reviews,"This one thousand year history of the civilization of western Europe has already been recognized in France as a scholarly contribution of the highest order and as a popular classic. Jacques Le Goff has written a book which will not only be read by generations of students and historians, but which will delight and inform all those interested in the history of medieval Europe. Part one, Historical Evolution, is a narrative account of the entire period, from the barbarian settlement of Roman Europe in the fifth, sixth and seventh centuries to the war-torn crises of Christian Europe in the fourteenth and fifteenth centuries.

Part two, Medieval Civilization, is analytical, concerned with the origins of early medieval ideas of culture and religion, the constraints of time and space in a pre-industrial world and the reconstruction of the lives and sensibilities of the people during this long period. Medieval Civilization combines the narrative and descriptive power characteristic of Anglo-Saxon scholarship with the sensitivity and insight of the French historical tradition.",https://www.goodreads.com/book/show/343921.Medieval_Civilization_400_1500
The Boys in the Boat: Nine Americans and Their Epic Quest for Gold at the 1936 Berlin Olympics,"Daniel James Brown, Daniel James Brown","Nonfiction, History, Book Club, Sports, Biography, Audiobook, Historical, World War II, American History, Memoir",4.39,"357,500 ratings","31,953 reviews","For readers of Unbroken, out of the depths of the Depression comes an irresistible story about beating the odds and finding hope in the most desperate of times—the improbable, intimate account of how nine working-class boys from the American West showed the world at the 1936 Olympics in Berlin what true grit really meant.

It was an unlikely quest from the start. With a team composed of the sons of loggers, shipyard workers, and farmers, the University of Washington’s eight-oar crew team was never expected to defeat the elite teams of the East Coast and Great Britain, yet they did, going on to shock the world by defeating the German team rowing for Adolf Hitler. The emotional heart of the tale lies with Joe Rantz, a teenager without family or prospects, who rows not only to regain his shattered self-regard but also to find a real place for himself in the world. Drawing on the boys’ own journals and vivid memories of a once-in-a-lifetime shared dream, Brown has created an unforgettable portrait of an era, a celebration of a remarkable achievement, and a chronicle of one extraordinary young man’s personal quest.",https://www.goodreads.com/book/show/16158542-the-boys-in-the-boat
The Cheese and the Worms: The Cosmos of a Sixteenth-Century Miller,"Carlo Ginzburg, John Tedeschi, Anne C. Tedeschi, Carlo Ginzburg","History, Nonfiction, Religion, Italy, European History, Microhistory, Academic, School, Anthropology, Medieval History",4.01,"6,870 ratings",624 reviews,"The Cheese and the Worms is a study of the popular culture in the sixteenth century as seen through the eyes of one man, a miller brought to trial during the Inquisition. Carlo Ginzburg uses the trial records of Domenico Scandella, a miller also known as Menocchio, to show how one person responded to the confusing political and religious conditions of his time.

For a common miller, Menocchio was surprisingly literate. In his trial testimony he made references to more than a dozen books, including the Bible, Boccaccio's Decameron, Mandeville's Travels, and a ""mysterious"" book that may have been the Koran. And what he read he recast in terms familiar to him, as in his own version of the creation: ""All was chaos, that is earth, air, water, and fire were mixed together; and of that bulk a mass formed—just as cheese is made out of milk—and worms appeared in it, and these were the angels.""",https://www.goodreads.com/book/show/71148.The_Cheese_and_the_Worms
"The Face of Battle: A Study of Agincourt, Waterloo and the Somme","John Keegan, John Keegan","History, Nonfiction, Military History, Military Fiction, War, European History, World War I, Audiobook, Psychology, World History",4.12,"8,596 ratings",433 reviews,"The Face of Battle is military history from the battlefield: a look at the direct experience of individuals at 'the point of maximum danger'. It examines the physical conditions of fighting, the particular emotions and behaviour generated by battle, as well as the motives that impel soldiers to stand and fight rather than run away.

In his scrupulous reassessment of three battles, John Keegan vividly conveys their reality for the participants, whether facing the arrow cloud of Agincourt, the levelled muskets of Waterloo or the steel rain of the Somme.",https://www.goodreads.com/book/show/275833.The_Face_of_Battle
Rising Tide: the Great Mississippi Flood of 1927 and How it Changed America,"John M. Barry, John M. Barry","History, Nonfiction, American History, Politics, Nature, Book Club, Historical, Southern, Environment, American",4.22,"5,801 ratings",612 reviews,"In 1927, the Mississippi River swept across an area roughly equal in size to Massachusetts, Connecticut, New Hampshire, and Vermont combined, leaving water as deep as thirty feet on the land stretching from Illinois and Missouri south to the Gulf of Mexico. Close to a million people—in a nation of 120 million—were forced out of their homes. Some estimates place the death toll in the thousands. The Red Cross fed nearly 700,000 refugees for months. Rising Tide is the story of this forgotten event, the greatest natural disaster this country has ever known. But it is not simply a tale of disaster. The flood transformed part of the nation and had a major cultural and political impact on the rest.

is an American epic about science, race, honor, politics, and society. begins in the nineteenth century, when the first serious attempts to control the river began. The story focuses on engineers James Eads and Andrew Humphreys, who hated each other. Out of the collision of their personalities and their theories came a compromise river policy that would lead to the disaster of the 1927 flood yet would also allow the cultivation of the Yazoo-Mississippi Delta and create wealth and aristocracy, as well as a whole culture. In the end, the flood had indeed changed the face of America, leading to the most comprehensive legislation the government had ever enacted, touching the entire Mississippi valley from Pennsylvania to Montana. In its aftermath was laid the foundation for the New Deal of Franklin D. Roosevelt.",https://www.goodreads.com/book/show/49376.Rising_Tide
"Inferno: The World at War, 1939-1945","Max Hastings, Max Hastings","History, Nonfiction, War, World War II, Military History, Military Fiction, Audiobook, World History, European History, Historical",4.36,"10,970 ratings",904 reviews,"From one of our finest military historians, a monumental work that shows us at once the truly global reach of World War II and its deeply personal consequences.

World War II involved tens of millions of soldiers and cost sixty million lives—an average of twenty-seven thousand a day. For thirty-five years, Max Hastings has researched and written about different aspects of the war. Now, for the first time, he gives us a magnificent, single-volume history of the entire war.

Through his strikingly detailed stories of everyday people—of soldiers, sailors and airmen; British housewives and Indian peasants; SS killers and the citizens of Leningrad, some of whom resorted to cannibalism during the two-year siege; Japanese suicide pilots and American carrier crews—Hastings provides a singularly intimate portrait of the world at war. He simultaneously traces the major developments—Hitler’s refusal to retreat from the Soviet Union until it was too late; Stalin’s ruthlessness in using his greater population to wear down the German army; Churchill’s leadership in the dark days of 1940 and 1941; Roosevelt’s steady hand before and after the United States entered the war—and puts them in real human context.

Hastings also illuminates some of the darker and less explored regions under the war’s penumbra, including the conflict between the Soviet Union and Finland, during which the Finns fiercely and surprisingly resisted Stalin’s invading Red Army; and the Bengal famine in 1943 and 1944, when at least one million people died in what turned out to be, in Nehru’s words, “the final epitaph of British rule” in India.

Remarkably informed and wide-ranging, Inferno is both elegantly written and cogently argued. Above all, it is a new and essential understanding of one of the greatest and bloodiest events of the twentieth century.",https://www.goodreads.com/book/show/11256415-inferno
Warriors of God: Richard the Lionheart and Saladin in the Third Crusade,"James Reston Jr., James Reston Jr.","History, Nonfiction, Middle East, Religion, Medieval History, Medieval, Biography, Islam, Military History, War",3.96,"2,025 ratings",135 reviews,"Acclaimed author James Reston, Jr.'s Warriors of God is the rich and engaging account of the Third Crusade (1187-1192), a conflict that would shape world history for centuries and which can still be felt in the Middle East and throughout the world today. James Reston, Jr. offers a gripping narrative of the epic battle that left Jerusalem in Muslim hands until the twentieth century, bringing an objective perspective to the gallantry, greed, and religious fervor that fueled the bloody clash between Christians and Muslims.

As he recounts this rousing story, Reston brings to life the two legendary figures who led their armies against each other. He offers compelling portraits of Saladin, the wise and highly cultured leader who created a united empire, and Richard the Lionheart, the romantic personification of chivalry who emerges here in his full complexity and contradictions. From its riveting scenes of blood-soaked battles to its pageant of fascinating, larger-than-life characters, Warriors of God is essential history, history that helps us understand today's world.",https://www.goodreads.com/book/show/55702.Warriors_of_God
The Law,"Frédéric Bastiat, Frédéric Bastiat","Politics, Philosophy, Economics, Nonfiction, Law, Classics, History, Political Science, France, Government",4.34,"13,842 ratings","1,235 reviews","How is it that the law enforcer itself does not have to keep the law? How is it that the law permits the state to lawfully engage in actions which, if undertaken by individuals, would land them in jail? These are among the most intriguing issues in political and economic philosophy. More specifically, the problem of law that itself violates law is an insurmountable conundrum of all statist philosophies. The problem has never been discussed so profoundly and passionately as in this essay by Frederic Bastiat from 1850. The essay might have been written today. It applies in ever way to our own time, which is precisely why so many people credit this one essay for showing them the light of liberty. Bastiat's essay here is timeless because applies whenever and wherever the state assumes unto itself different rules and different laws from that by which it expects other people to live. And so we have this legendary essay, written in a white heat against the lead",https://www.goodreads.com/book/show/1609224.The_Law
