Title,Author,Genres,Avg_Rating,Num_Ratings,Num_Reviews,Description,Book_URL
"The law of freedom in a platform: or, True magistracy restored Humbly presented to Oliver Cromwel, General of the Common-wealths army in England. And ... brethren whether in church-fellowship","Gerrard Winstanley, Gerrard Winstanley",History,3.44,16 ratings,2 reviews,"EARLY DOCUMENTS OF WORLD HISTORY. Imagine holding history in your hands. Now you can. Digitally preserved and previously accessible only through libraries as Early English Books Online, this rare material is now available in single print editions. Thousands of books written between 1475 and 1700 can be delivered to your doorstep in individual volumes of high quality historical reproductions. This collection combines early English perspectives on world history with documentation of Parliament records, royal decrees and military documents that reveal the delicate balance of Church and State in early English government. For social historians, almanacs and calendars offer insight into daily life of common citizens. This exhaustively complete series presents a thorough picture of history through the English Civil War.


++++

The below data was compiled from various identification fields in the bibliographic record of this title. This data is provided as an additional tool in helping to insure edition

++++


The law of freedom in a or, True magistracy restored Humbly presented to Oliver Cromwel, General of the Common-wealths army in England. And to all English-men my brethren whether in church-fellowship
Winstanley, Gerrard, b. 1609.
With a table of contents and advertisment page at end of text.
A reissue of the other 1652 edition, with a new title page.
89, [3] p.
London : printed by J.M. for the author, and are to be sold by Giles Calvert at the black Spred-Eagle at the west end of Pauls, 1652.
Wing (2nd ed.) / W3045A
English
Reproduction of the original in the Bodleian Library


++++


This book represents an authentic reproduction of the text as printed by the original publisher. While we have attempted to accurately maintain the integrity of the original work, there are sometimes problems with the original work or the micro-film from which the books were digitized. This can result in errors in reproduction. Possible imperfections include missing and blurred pages, poor pictures, markings and other reproduction issues beyond our control. Because this work is culturally important, we have made it available as part of our commitment to protecting, preserving and promoting the world's literature.",https://www.goodreads.com/book/show/11181744-the-law-of-freedom-in-a-platform
Flight of the Goose: A Story of the Far North,"Lesley Thomas, Lesley Thomas","Fiction, Historical Fiction, Indigenous, Romance, Nature, Fantasy, Outdoors",4.16,152 ratings,25 reviews,"""An) exquisite example of storytelling... A gifted writer with a sense of Alaska Native culture and tradition..."" ~ ""First Alaskans Magazine""

""Flight of the Goose"" is an award-winning novel set in a traditional village and the wilds of the far north, where author Lesley Thomas grew up.

praise by Fred Bigjim, Inupiaq author of ""Plants: A Novel, Echoes from the Tundra""

""A remarkable achievement... About loss and loneliness, alienation and fear, acceptance and forgiveness, natural and supernatural (whose) characters seem drawn from life. Its complex treatment of problems that face us all in a world of unavoidable change and contact, will haunt the reader long after the covers have been closed.""

""A serious work of modern literature... Portrays a world in which traditional values clash with modern expectations."" ~ ""Alaska Anthropological Association""

Shamanism, sorcery, witchcraft...and science!
Violence, villains, wildlife adventures!
Culture clash, climate change, Big Oil and draft dodgers!
Wolves, grizzly bears, polar bears, seals, walrus, fish, reindeer and birds birds birds!

all within a haunting love story that one reviewer compared to ""Wuthering Heights,"" another calling it ""Romeo and Juliet of the Arctic"" -

""Amazing... I loved this book (and) am recommending it to everyone I meet."" ~ Sandra Ingerman, author of ""Soul Retrieval""

""Flight of the Goose"" won first place in several literary contests. It is endorsed by Alaska Native Elders, anthropologists, scientists, writers, missionaries and shamans.

""Moving and extremely well-written... Besides shamanic themes... the story addresses many other significant issues - climate change, environmental crisis, and indigenous rights - and it does so with both artistry and insight."" ~ ""Shaman’s Drum Journal""


1971, the Alaskan Arctic. ""It was a time when much was hidden, before outsiders came on bended knee to learn from the elders. Outsiders came, but it was not to learn from us; it was to change us. There was a war and a university, an oil company and a small village, all run by men. There was a young man who hunted geese to feed his family and another who studied geese to save them. And there was a young woman who flew into the world of spirits to save herself...""
So relates Kayuqtuq Ugungoraseok, ""the red fox"". An orphan traumatized by her past, she seeks respect in her traditional Inupiat village through the outlawed path of shamanism. Her plan leads to tragedy when she interferes with scientist Leif Trygvesen, who has come to research the effects of oil spills on salt marshes - and evade the draft.
Told from both Kayuqtuq's and Leif's perspectives, Flight of the Goose is a tale of cultural conflict, spiritual awakening, redemption and love in a time when things were - to use the phrase of an old arctic shaman - ""no longer familiar"".

""What an extraordinary novel... (Thomas) deals with shamanism and sorcery in a very realistic way..."" ~ ""Sacred Hoop Magazine""


""Masterful... Remarkable... Gripping...The authenticity palpable... A joy, a big broad deep river of a book, a work of substance and great beauty of both vision and style... I was moved by the characters and their fates as I have not been by a novel in a long time."" ~ Richard Hoffman, author of ""Half the House""


Read at universities and schools, book-clubs and in academic libraries worldwide",https://www.goodreads.com/book/show/673501.Flight_of_the_Goose
"Today Hong Kong, Tomorrow the World: what China's Crackdown Reveals about Its Plans to End Freedom Everywhere","Mark L. Clifford, Mark L. Clifford","China, Politics, Nonfiction, History, Journalism, Society, Current Affairs",4.25,132 ratings,34 reviews,"A gripping history of China's deteriorating relationship with Hong Kong, and its implications for the rest of the world.

For 150 years as a British colony, Hong Kong was a beacon of prosperity where people, money, and technology flowed freely, and residents enjoyed many civil liberties. In preparation for handing the territory over to China in 1997, Deng Xiaoping promised that it would remain highly autonomous for fifty years. An international treaty established a Special Administrative Region (SAR) with a far freer political system than that of Communist China―one with its own currency and government administration, a common-law legal system, and freedoms of press, speech, and religion.

But as the halfway mark of the SAR’s lifespan approaches in 2022, it is clear that China has not kept its word. Universal suffrage and free elections have not been instituted, harassment and brutality have become normalized, and activists are being jailed en masse. To make matters worse, a national security law that further crimps Hong Kong’s freedoms has recently been decreed in Beijing. This tragic backslide has dire worldwide implications―as China continues to expand its global influence, Hong Kong serves as a chilling preview of how dissenters could be treated in regions that fall under the emerging superpower’s control.

Today Hong Kong, Tomorrow the World tells the complete story of how a city once famed for protests so peaceful that toddlers joined grandparents in millions-strong rallies became a place where police have fired more than 10,000 rounds of tear gas, rubber bullets and even live ammunition at their neighbors, while pro-government hooligans attack demonstrators in the streets. A Hong Kong resident from 1992 to 2021, author Mark L. Clifford has witnessed this transformation firsthand. As a celebrated publisher and journalist, he has unrivaled access to the full range of the city’s society, from student protestors and political prisoners to aristocrats and senior government officials. A powerful and dramatic mix of history and on-the-ground reporting, this book is the definitive account of one of the most important geopolitical standoffs of our time.",https://www.goodreads.com/book/show/58672970-today-hong-kong-tomorrow-the-world
N/A,N/A,N/A,N/A,N/A,N/A,N/A,https://www.goodreads.com/book/show/18471848-the-historical-failure-of-anarchism
Konsum und Gewalt - Radikaler Protest in der Bundesrepublik,"Alexander Sedlmaier, Alexander Sedlmaier",N/A,4.25,4 ratings,1 review,"Nachdem in der Nacht auf den 3. April 1968 in zwei Frankfurter Kaufhäusern mehrere Brandsätze gezündet hatten, fanden die Ermittler bei den Tatverdächtigen einen Zettel: »Der Konsumzwang terrorisiert euch. Wir terrorisieren die Ware.« Die Anschläge, an denen unter anderem die späteren Mitbegründer der RAF Andreas Baader und Gudrun Ensslin beteiligt waren, griffen eine im Kontext des Kalten Kriegs erstarkende Dimension der Gesellschaftskritik auf. Verstand die klassische marxistische Analyse die Produktion als die eigentliche Sphäre der Unterdrückung, so erschien nun zunehmend der Konsum als Reich der Unfreiheit. Widerstand gegen den »Konsumterror« galt als legitim, einigen sogar dann, wenn er militante Formen annahm.
Gestützt auf umfangreiche Archivstudien, zeichnet Alexander Sedlmaier die Entwicklung der Konsumkritik in der Bundesrepublik nach. Er erläutert die insbesondere durch Herbert Marcuse formulierten theoretischen Grundlagen und stellt dar, wie sich der Protest im Zuge der Kampagnen gegen die Springer-Presse und Fahrpreiserhöhungen im öffentlichen Nahverkehr radikalisierte, bevor er in der Hausbesetzerszene zu einer eigenen Lebensform wurde.",https://www.goodreads.com/book/show/45857419-konsum-und-gewalt---radikaler-protest-in-der-bundesrepublik
Rebels' Ride,"Ethel Mannin, Ethel Mannin",N/A,2.00,1 rating,0 reviews,,https://www.goodreads.com/book/show/17306125-rebels-ride
The Factory: A Marxist Tale of Revolution,"Antonio Melonio, Antonio Melonio",Fiction,4.28,25 ratings,11 reviews,"I awoke in utter darkness and found myself in chains — had I always been a prisoner?

Soldiers came. They led us to the Factory, an eternal place of toil and suffering. Long slender shapes in perfect suits put us to work, and then... we worked. There was no light, no rest, and no food to be had; there were only the machines, the smoke, the rats, and the useless products we made — forever. And above us, loomed the Tower. Not one of us had ever entered it; we just watched as it grew taller and taller, fueled by our misery.

And then: a gesture of kindness. A soldier with a soul. It changed everything. The hammers in our hands felt different then, and one by one, we began lifting them. Not for work; not this time. But for freedom!",https://www.goodreads.com/book/show/122783785-the-factory
Alloy Cooperative,"K.J. Noakes, K.J. Noakes",N/A,5.00,3 ratings,3 reviews,"Gram is angry at work, and not just because of his bad back. The forge he works at sits atop the biggest Mythril Meteorite ever to fall on Thelre – or perhaps on all of Geos – and the riches it brings in are squandered by the grandson of the late owner. When Gram stumbles on an ancient Geomancer Fossil Tome, it shows him that another way of running the world is possible. Alloy Cooperative is an Anarcho-Syndicalist Fantasy novella, about a blacksmith unionizing his forge to overthrow their nepotist boss and turn it into a worker-owned cooperative.

Geos is a world where it no longer rains, and powerful magic meteorites fall from the sky – bringing riches to the few, and destruction to the many. Wars are fought over well water, and get even more vicious when magic metals such as healing gold are on the line. The peninsular Republic of Thelre thinks itself above such conflicts, with its Republican Democracy and Open Courts system, yet all to often it is wealth that guides the decisions of the Prime Minister and the Judges. But one group of forge workers is going to show the destitute working classes of Geos the true power and value of their labour.",https://www.goodreads.com/book/show/93310973-alloy-cooperative
N/A,N/A,N/A,N/A,N/A,N/A,N/A,https://www.goodreads.com/book/show/127649140-the-slavery-of-our-times
"Nestor Makhno and Rural Anarchism in Ukraine, 1917-1921","Colin Darch, Colin Darch","History, Politics, Russian Revolution, Ukraine",3.95,38 ratings,5 reviews,"Histories of the Russian Revolution often present the Bolshevik seizure of power in 1917 as the central event, neglecting the diverse struggles of urban and rural revolutionaries across the heartlands of the Russian Empire. This book takes as its subject one such struggle, the anarcho-communist peasant revolt led by Nestor Makhno in left-bank Ukraine, locating it in the context of the final collapse of the Empire that began in 1914.

Between 1917 and 1921, the Makhnovists fought German and Austrian invaders, reactionary monarchist forces, Ukrainian nationalists and sometimes the Bolsheviks themselves. Drawing upon anarchist ideology, the Makhnovists gathered widespread support amongst the Ukrainian peasantry, taking up arms when under attack and playing a significant role - in temporary alliance with the Red Army - in the defeats of the White Generals Denikin and Wrangel. Often dismissed as a kulak revolt, or a manifestation of Ukrainian nationalism, Colin Darch analyses the successes and failures of the Makhnovist movement, emphasising its revolutionary character.

Over 100 years after the revolutions, this book reveals a lesser known side of 1917, contributing both to histories of the period and broadening the narrative of 1917, whilst enriching the lineage of anarchist history.",https://www.goodreads.com/book/show/48856303-nestor-makhno-and-rural-anarchism-in-ukraine-1917-1921
"Creativity, Teaching, and Natural Inspiration","Mark Doherty, Mark Doherty",N/A,4.57,7 ratings,7 reviews,"Creativity, Teaching, and Natural Inspiration follows the evolution of a high school English teacher as he develops a creative and innovative teaching style despite being juxtaposed against a public education system bent on didactic, normalizing regulations and political demands.

Doherty crafts an engaging nonfiction story that utilizes memoir, anecdote, poetry, and dialogue to explore how mixing creativity and pedagogy can change the way budding students visualize creative writing: A chunk of firewood plunked on a classroom table becomes part of a sawmill, a mine timber, an Anasazi artifact...it also becomes a poem, a song, an essay, and a memoir. The long, slender feather of a Sandhill Crane evokes Muir, Thoreau, Audubon, Leopold, Carson...even parables of lore and magic.

Creativity holds the stitches of this book together and runs throughout each chapter like fragrant woodsmoke.",https://www.goodreads.com/book/show/52078388-creativity-teaching-and-natural-inspiration
Frontlash / Backlash,"Jeffrey C. Alexander, Jeffrey C. Alexander",N/A,5.00,29 ratings,14 reviews,"In the aftermath of the Cold War, many societies seemed firmly set on a pathway to cultural reintegration, progressive reform, and democratic government. This didn�t happen. Instead, they have become increasingly polarized, and far-right antidemocratic forces are gaining power. In his new work, Jeffrey Alexander explains why, developing an approach to social change that challenges the faith in progress that underpins much contemporary thinking.

Far from being a smooth movement forward, progressive social change is like a car crash where cars pile up. The greater the movement forward, the greater the reaction to it. Reform movements – such as anti-racism, feminism, and open immigration – should be understood as movements creating extraordinary tensions. They challenge not only material interests but ideal ones – the taken-for-granted meanings that have made life worth living for those on the traditional side. Angry backlash movements slam on the brakes. They aim not only to halt forward progress, but to move backward, to how things were in the good old days.

Today we are witnessing a surge of powerful backlash movements in many parts of the world – in the US, in Europe, in India, and elsewhere. Against these onslaughts, the universalizing culture and institutions of democratic civil spheres have so far managed to retain their resilience, but how long can they continue to hold?",https://www.goodreads.com/book/show/231159754-frontlash-backlash
Chaos Theory: Two Essays on Market Anarchy,"Robert P. Murphy, Robert P. Murphy","Economics, Politics, Philosophy, Nonfiction, Political Science, Essays, Business",3.84,602 ratings,62 reviews,"Among the most advanced topics in the literature of the Austrolibertarian milieu is that which deals with the workings of the fully free society, that is, the society with no state, or anarchocapitalism. Robert Murphy deals with this head on, and makes the first full contribution to this literature in the new century. Working within a Rothbardian framework, he takes up the challenge of Hans Hoppe regarding the role of market insurance in property security to extend the analysis to the security of person.

His applications are part empirical and part speculative, but unfailingly provocative, rigorous, and thoughtful. The title itself refers to the supposed chaos that results from eliminating the state, but Murphy shows that out of chaos grows an ordered liberty. Anyone interested in exploring the farthest reaches of anarchist theory must come to terms with Murphy's account.

To search for Mises Institute titles, enter a keyword and LvMI (short for Ludwig von Mises Institute); e.g., Depression LvMI",https://www.goodreads.com/book/show/159697.Chaos_Theory
Bash The Rich: True-life Confessions of an Anarchist in the UK,"Ian Bone, Ian Bone","Politics, Nonfiction, Biography, History, Autobiography",3.82,110 ratings,14 reviews,"In 1984, ""The People"" branded Ian Bone 'the most dangerous man in Britain'. They were only too close to the truth. From the inner city riots of 1981 to the miners' strike and beyond, the butler's son and founder of ""Class War"" was indeed a greater thorn in Margaret Thatcher's side than the useless blatherings of the Official Opposition. ""Class War"" was the real opposition It was Ian Bone who linked the inner city rioters of Brixton and Handsworth with the striking miners. It was Bone who ""The People"" spotted rioting with miners in Mansfield, attacking laboratories with the Animal Liberation Front, and who was fingered by the ""Guardian"" as the man behind the 1985 Brixton Riot. But that was only the half of it... from 1965 to 1985, from Swansea to Cardiff and London the mayhem spread countrywide. In ""Bash The Rich"" Ian Bone tells it like it was. From The Angry Brigade to The Free Wales Army, from the 1967 Summer of Love to 1977 anarcho-punk, from Grosvenor Square to the Battle of the Beanfield, from the Stop the City riots to Bashing the Rich at the Henley Regatta, Ian Bone breaks his silence. In the 1980s, Ian Bone was 'The Anarchist In The UK' with a half brick in one hand and an incendiary pen in the other. Better yet though, this is more than just a litany of riots and rucks, however exciting. Its a thoughtful examination of class, struggle, and social change. And a wonderful, vital piece of social and political history.",https://www.goodreads.com/book/show/987128.Bash_The_Rich
The Political Philosophy of Poststructuralist Anarchism,"Todd May, Todd May","Philosophy, Politics, Nonfiction, Theory, Anarchism",3.70,139 ratings,10 reviews,"The political writings of the French poststructuralists have eluded articulation in the broader framework of general political philosophy primarily because of the pervasive tendency to define politics along a single the balance between state power and individual rights in liberalism and the focus on economic justice as a goal in Marxism. What poststructuralists like Michel Foucault, Gilles Deleuze, and Jean-François Lyotard offer instead is a political philosophy that can be called it emphasizes that power emerges from many different sources and operates along many different registers. This approach has roots in traditional anarchist thought, which sees the social and political field as a network of intertwined practices with overlapping political effects. The poststructuralist approach, however, eschews two questionable assumptions of anarchism, that human beings have an (essentially benign) essence and that power is always repressive, never productive. After positioning poststructuralist political thought against the background of Marxism and the traditional anarchism of Bakunin, Kropotkin, and Proudhon, Todd May shows what a tactical political philosophy like anarchism looks like shorn of its humanist commitments―namely, a poststructuralist anarchism. The book concludes with a defense, contra Habermas and Critical Theory, of poststructuralist political thought as having a metaethical structure allowing for positive ethical commitments.",https://www.goodreads.com/book/show/667890.The_Political_Philosophy_of_Poststructuralist_Anarchism
"Italian Anarchism, 1864-1892","Nunzio Pernicone, Nunzio Pernicone","History, Nonfiction, Italy, Politics, Anarchism",4.20,35 ratings,4 reviews,"“Pernicone's book is the most comprehensive and balanced study to date of the Italian anarchist movement.”—American Historical Review

Russian revolutionary Mikhail Bakunin nurtured anarchism in Italy, making it the dominant expression of socialism—triumphant over Marxism and all other revolutionary doctrines. From the First International to the 1872 Anti-Authoritarian International, from government suppression and anarchist insurrection to Errico Malatesta's prominent role in resurrecting the anarchist movement, Nunzio Pernicone's original research provides a critical examination of early anarchist practices.

is an associate professor of history at Drexel University. He is the author of .",https://www.goodreads.com/book/show/5677204-italian-anarchism-1864-1892
Jackboot Britain,"Daniel S. William Fletcher, Fletch., Daniel S. William Fletcher","Fiction, Alternate History, Historical Fiction, World War II, War, Dystopia, Science Fiction",3.67,112 ratings,12 reviews,"JACKBOOT BRITAIN, by Daniel S. Fletcher, is set in an alternate 1940, in which Nazi Germany was victorious over the British Empire. Jackboot Britain is a nightmare world; the book follows the trials and tribulations of a range of characters from various walks of life, as they struggle to exist in a Europe - and Britain - ruled by the Germany of Adolf Hitler.

From captured British troops held as Prisoners of War, to Major Jochen Wolf and the conflicted, and conflicting SS men in whose care they are placed; to auxiliary partisans in the underground British resistance, anti-fascist veterans of the Spanish Civil War; to a young, female Jewish teacher in Leeds and her clever, quirky male friend; a London shopgirl and an unwilling German soldier drafted to the Wehrmacht; Bill Wilson, a monosyllabic alcoholic in a Bloomsbury pub; a humanist-libertarian journalist; four young conscripts to the German occupation force; a disabled cockney street kid; the men of the SS Einsatzgruppen (action groups), whose 'police' work in occupied countries was a euphemism for murder and suppression; to the SS leaders themselves and their machinations for power, including ""The Blond Beast"", one of the 20th century's most notorious villains in Reinhard Heydrich himself...

The tapestry of their lives is woven through the powerful tale of a dystopian world that could have been...

Jackboot Britain depicts the grim realities of a Nazi Britain and Hitler's Europe through the lives and deaths, triumphs, setbacks and tragedies of a diverse range of characters, all of whom are caught up in the carnage and chaos of war.",https://www.goodreads.com/book/show/22093713-jackboot-britain
Spark,"Rupert Dreyfus, Rupert Dreyfus","Fiction, Politics",4.41,54 ratings,28 reviews,"""Dreyfus writes with the darkly absurd humour of a thirsty and somewhat paranoid Jonathan Swift"" - Pop Matters


Jake Miller has just been shot by a member of the British Counterterrorism Unit. As he lies on his bedroom floor, wondering if he’s going to bleed out, he attempts to put the last few months of his life into perspective. One minute he’s starting a high-flying job in the corporate banking sector; the next minute he’s commanding a legion of disaffected computer users known as Generation Y-bother. They know Jake only by his hacking name Spark and the videos he uploads to his Youtube account, but they’re determined to help him bring about the end of the world as we know it. The problem is not everybody’s on board his battleship…

Spark is Rupert's debut novel which takes a swipe at corporate culture and the Westminster pantomime. A thank you letter to hacktivist groups such as Anonymous; this is guerrilla fiction for the Digital Age.",https://www.goodreads.com/book/show/23604631-spark
