Title,Author,Genres,Avg_Rating,Num_Ratings,Num_Reviews,Description,Book_URL
The Dispossessed: An Ambiguous Utopia,"Ursula K. Le Guin, Ursula K. Le Guin","Science Fiction, Fiction, Fantasy, Classics, Dystopia, Science Fiction Fantasy, Book Club",4.26,"147,420 ratings","12,982 reviews","Shevek, a brilliant physicist, decides to take action. He will seek answers, question the unquestionable, and attempt to tear down the walls of hatred that have isolated his planet of anarchists from the rest of the civilized universe. To do this dangerous task will mean giving up his family and possibly his life—Shevek must make the unprecedented journey to the utopian mother planet, Urras, to challenge the complex structures of life and living, and ignite the fires of change.",https://www.goodreads.com/book/show/13651.The_Dispossessed
Anarchism and Other Essays,"Emma Goldman, Emma Goldman","Politics, Nonfiction, Philosophy, Feminism, Essays, History, Theory",4.06,"7,128 ratings",470 reviews,"Emma Goldman is often depicted in current academic discourse as a mere prototypical feminist and socialist. Yet this collection of essays by Goldman reveals that she often expressed ideas which many of her present day admirers might find surprising and unsettling. She distrusted the proletariat, wrote disdainfully of the early feminists who were her contemporaries, and even expressed scepticism of women's suffrage. Goldman was an admirer of Nietzsche and in many ways represents a model of a superior individual who is capable of rising above the herd instincts of the masses and embracing confrontation with danger. She never hesitated to countenance both the ire of public authorities and the scorn of public opinion. As contemporary anarchists have fallen into the mundane habit of politically correct conformity, a full examination of Goldman's thought suggests the need for a new anarchism that reflects the martial spirit of which Goldman was an exemplary.
Emma Goldman is often depicted in current academic discourse, and the “Left” in particular, as a role model for feminists and a champion of the proletariat. Keith Preston however in reviewing each chapter of Goldman’s most famous work “Anarchism and Other Essays” reveals that Emma Goldman often expressed ideas which many of her present day admirers will find surprising and unsettling. He highlights the fact that Emma Goldman distrusted the proletariat, wrote disdainfully of the early feminists who were her contemporaries, and expressed scepticism of women’s suffrage.
Keith Preston maintains that Emma Goldman can only be really understood by recognising her admiration for the ideas of the German philosopher Friedrich Nietzsche (an admiration that she shared with Adolf Hitler and the National Socialists). He argues that Emma Goldman (as with Nietzsche’s “Zarathustra”) represents a model of a “superior individual” who is capable of rising above the herd instincts of the masses - one who never hesitated to countenance both the ire of public authorities and the scorn of public opinion. Politically correct she was not.",https://www.goodreads.com/book/show/551926.Anarchism_and_Other_Essays
V for Vendetta,"Alan Moore, David Lloyd, Steve Whitaker, Alan Moore",N/A,4.26,"323,014 ratings","8,059 reviews","""Remember, remember the fifth of November...""

A frightening and powerful tale of the loss of freedom and identity in a chillingly believable totalitarian world, V for Vendetta stands as one of the highest achievements of the comics medium and a defining work for creators Alan Moore and David Lloyd.

Set in an imagined future England that has given itself over to fascism, this groundbreaking story captures both the suffocating nature of life in an authoritarian police state and the redemptive power of the human spirit which rebels against it. Crafted with sterling clarity and intelligence, brings an unequaled depth of characterization and verisimilitude to its unflinching account of oppression and resistance.",https://www.goodreads.com/book/show/5805.V_for_Vendetta
Chomsky On Anarchism,"Noam Chomsky, Barry Pateman, Noam Chomsky","Politics, Nonfiction, Philosophy, History, Theory, Economics, Essays",3.84,"11,445 ratings",914 reviews,"We all know what Noam Chomsky is against. His scathing analysis of everything that’s wrong with our society reaches more and more people every day. His brilliant critiques of—among other things—capitalism, imperialism, domestic repression and government propaganda have become mini-publishing industries unto themselves. But, in this flood of publishing and republishing, very little ever gets said about what exactly Chomsky stands for, his own personal politics, his vision of the future.

Not, that is, until Chomsky on Anarchism, a groundbreaking new book that shows a different side of this best-selling author: the anarchist principles that have guided him since he was a teenager. This collection of Chomsky’s essays and inter-views includes numerous pieces that have never been published before, as well as rare material that first saw the light of day in hard-to-find pamphlets and anarchist periodicals. Taken together, they paint a fresh picture of Chomsky, showing his lifelong involvement with the anarchist community, his constant commitment to nonhierarchical models of political organization and his hopes for a future world without rulers.

For anyone who’s been touched by Chomsky’s trenchant analysis of our current situation, as well as anyone looking for an intelligent and coherent discussion of anarchism itself, look no further than .

is one of the world’s leading intellectuals, the father of modern linguistics, an outspoken media and foreign policy critic and tireless activist. He lives in Boston, Massachusetts.",https://www.goodreads.com/book/show/12618.Chomsky_On_Anarchism
The Conquest of Bread,"Pyotr Kropotkin, Demián Reyes, Pyotr Kropotkin","Politics, Philosophy, Nonfiction, Economics, Theory, History, Classics",4.06,"9,657 ratings",905 reviews,"The fourth in AK Press’ Working Classics series, The Conquest of Bread is Peter Kropotkin’s most extensive study of human needs and his outline of the most rational and equitable means of satisfying them. A combination of detailed historical analysis and far-reaching Utopian vision, this is a step-by-step guide to social revolution: the concrete means of achieving it, and the world that humanity’s “constructive genius” is capable of creating. Includes a new introduction that historically situates and discusses the contemporary relevance of Kropotkin’s ideas.",https://www.goodreads.com/book/show/1113155.The_Conquest_of_Bread
1984,"George Orwell, George Orwell","Classics, Fiction, Science Fiction, Dystopia, Literature, Politics, Novels",4.20,"5,345,120 ratings","149,706 reviews","The year 1984 has come and gone, but George Orwell's prophetic, nightmarish vision in 1949 of the world we were becoming is timelier than ever. 1984 is still the great modern classic of ""negative utopia""—a startlingly original and haunting novel that creates an imaginary world that is completely convincing, from the first sentence to the last four words. No one can deny the novel's hold on the imaginations of whole generations, or the power of its admonitions—a power that seems to grow, not lessen, with the passage of time.",https://www.goodreads.com/book/show/5470.1984
Homage to Catalonia,"George Orwell, Lionel Trilling, George Orwell","History, Nonfiction, Politics, Classics, War, Memoir, Biography",4.09,"69,912 ratings","4,900 reviews",In 1936 George Orwell travelled to Spain to report on the Civil War and instead joined the fight against the Fascists. This famous account describes the war and Orwell’s own experiences. Introduction by Lionel Trilling.,https://www.goodreads.com/book/show/9646.Homage_to_Catalonia
Animal Farm,"George Orwell, Ann Patchett, Téa Obreht, George Orwell","Classics, Fiction, Dystopia, Fantasy, School, Politics, Literature",4.01,"4,452,713 ratings","127,768 reviews","After years of exploitation, neglect, and despair, the animals of Manor Farm revolt. They drive owner Mr. Jones off the land and rechristen the property Animal Farm, a utopia of equality and mutual support. But Napoleon, a young boar who assumes command after the rebellion, is hungry for power. And as the pigs consolidate control, all the good intentions of Animal Farm are crushed by a new and inevitable tyranny.

George Orwell’s Animal Farm, the chilling allegorical satire about the working class and the gripping rhetoric of despots, illustrates just how easy the slide into oppression and totalitarianism can be.",https://www.goodreads.com/book/show/7613.Animal_Farm
A People’s History of the United States: 1492 - Present,"Howard Zinn, Howard Zinn","History, Nonfiction, Politics, American History, Historical, Audiobook, Social Justice",4.09,"262,999 ratings","8,034 reviews","In the book, Zinn presented a different side of history from the more traditional ""fundamental nationalist glorification of country"".
Zinn portrays a side of American history that can largely be seen as the exploitation and manipulation of the majority by rigged systems that hugely favor a small aggregate of elite rulers from across the orthodox political parties.
A People's History has been assigned as reading in many high schools and colleges across the United States. It has also resulted in a change in the focus of historical work, which now includes stories that previously were ignored

Library Journal calls Howard Zinn’s book “a brilliant and moving history of the American people from the point of view of those…whose plight has been largely omitted from most histories.”",https://www.goodreads.com/book/show/2767.A_People_s_History_of_the_United_States
Anarcho-Syndicalism: Theory and Practice,"Rudolf Rocker, Mike Davis, Nicolas Walter, Rudolf Rocker",N/A,3.96,"1,690 ratings",97 reviews,"In 1937, at the behest of Emma Goldman, Rocker penned this political and philosophical masterpiece as an introduction to the ideals fueling the Spanish social revolution and resistance to capitalism the world over. Within, Rocker offers an introduction to anarchist ideas, a history of the international workers’ movement, and an outline of the syndicalist strategies and tactics embraced at the time (direct action, sabotage and the general strike). Includes a lengthy introduction by Nicholas Walter and a Preface by Noam Chomsky.

“[Rocker’s] approach is far from ‘utopian’; this is not an abstract discourse but a call to action.”—Noam Chomsky

Rudolf Rocker (1873–1958) was a leading figure in the international anarchist movement for over 60 years.",https://www.goodreads.com/book/show/51353.Anarcho_Syndicalism
The Monkey Wrench Gang,"Edward Abbey, Edward Abbey","Fiction, Nature, Environment, Classics, Humor, Politics, Novels",4.08,"28,920 ratings","2,070 reviews","Ed Abbey called The Monkey Wrench Gang, his 1975 novel, a ""comic extravaganza."" Some readers have remarked that the book is more a comic book than a real novel, and it's true that reading this incendiary call to protect the American wilderness requires more than a little of the old willing suspension of disbelief.

The story centers on Vietnam veteran George Washington Hayduke III, who returns to the desert to find his beloved canyons and rivers threatened by industrial development. On a rafting trip down the Colorado River, Hayduke joins forces with feminist saboteur Bonnie Abbzug, wilderness guide Seldom Seen Smith, and billboard torcher Doc Sarvis, M.D., and together they wander off to wage war on the big yellow machines, on dam builders and road builders and strip miners. As they do, his characters voice Abbey's concerns about wilderness preservation (""Hell of a place to lose a cow,"" Smith thinks to himself while roaming through the canyonlands of southern Utah. ""Hell of a place to lose your heart. Hell of a place... to lose. Period"").

Moving from one improbable situation to the next, packing more adventure into the space of a few weeks than most real people do in a lifetime, the motley gang puts fear into the hearts of their enemies, laughing all the while. It's comic, yes, and required reading for anyone who has come to love the desert.",https://www.goodreads.com/book/show/99208.The_Monkey_Wrench_Gang
Mutual Aid: A Factor of Evolution,"Pyotr Kropotkin, Pyotr Kropotkin","Politics, Philosophy, Nonfiction, Theory, History, Science, Sociology",4.23,"3,890 ratings",351 reviews,"In this cornerstone of modern liberal social theory, Peter Kropotkin states that the most effective human and animal communities are essentially cooperative, rather than competitive. Kropotkin based this classic on his observations of natural phenomena and history, forming a work of stunning and well-reasoned scholarship. Essential to the understanding of human evolution as well as social organization, it offers a powerful counterpoint to the tenets of Social Darwinism. It also cites persuasive evidence of human nature's innate compatibility with anarchist society.
""Kropotkin's basic argument is correct,"" noted evolutionary biologist Stephen Jay Gould. ""Struggle does occur in many modes, and some lead to cooperation among members of a species as the best pathway to advantage for individuals."" Anthropologist Ashley Montagu declared that "" will never be any more out of date than will the Declaration of Independence. New facts may increasingly become available, but we can already see that they will serve largely to support Kropotkin's conclusion that 'in the ethical progress of man, mutual support—not mutual struggle—has had the leading part.'"" Physician and author Alex Comfort asserted that ""Kropotkin profoundly influenced human biology by his theory of . . . . He was one of the first systematic students of animal communities, and may be regarded as the founder of modern social ecology.""",https://www.goodreads.com/book/show/51306.Mutual_Aid
"Days of War, Nights of Love: Crimethink For Beginners","CrimethInc., CrimethInc.","Nonfiction, Politics, Philosophy, Activism, Anarchism, Sociology, History",3.82,"2,397 ratings",173 reviews,"Beautifully designed A-Z of the totality of revolutionary youth politics. Sort of a Situ-inspired Steal This Book for everyday life, love, and how to live it. Heavily illustrated with photos, cartoons, posters, and other useful accoutrements for the new millenium. Believe the hype, and check out why this is already an underground bestseller.",https://www.goodreads.com/book/show/90416.Days_of_War_Nights_of_Love
Fight Club,"Chuck Palahniuk, Chuck Palahniuk","Fiction, Classics, Thriller, Contemporary, Novels, Mystery, Literature",4.18,"636,475 ratings","26,168 reviews","It follows the experiences of an unnamed protagonist struggling with insomnia. Inspired by his doctor's exasperated remark that insomnia is not suffering, the protagonist finds relief by impersonating a seriously ill person in several support groups. Then he meets a mysterious man named Tyler Durden and establishes an underground fighting club as radical psychotherapy.",https://www.goodreads.com/book/show/5759.Fight_Club
Anarchism: A Collection of Revolutionary Writings,"Pyotr Kropotkin, Pyotr Kropotkin","Politics, Philosophy, Nonfiction, Economics, History, Essays, Anarchism",4.18,904 ratings,38 reviews,"Important writings by the leading theorist of anarchism, including the brief but moving ""Spirit of Revolt,"" ""Law and Authority,"" an argument for social control through custom and education, and other documents. An invaluable addition to the libraries of instructors, students, and anyone interested in history, government, and anarchist thought.",https://www.goodreads.com/book/show/61001.Anarchism
"Walden or, Life in the Woods","Henry David Thoreau, Bill McKibben, Henry David Thoreau","Classics, Philosophy, Nonfiction, Nature, Memoir, Literature, Biography",3.77,"202,724 ratings","9,026 reviews","Originally published in 1854, Walden; or, Life in the Woods, is a vivid account of the time that Henry D. Thoreau lived alone in a secluded cabin at Walden Pond. It is one of the most influential and compelling books in American literature. This new paperback edition-introduced by noted American writer John Updike-celebrates the 150th anniversary of this classic work. Much of Walden's material is derived from Thoreau's journals and contains such engaging pieces as ""Reading"" and ""The Pond in the Winter"" Other famous sections involve Thoreau's visits with a Canadian woodcutter and with an Irish family, a trip to Concord, and a description of his bean field. This is the complete and authoritative text of Walden-as close to Thoreau's original intention as all available evidence allows. For the student and for the general reader, this is the ideal presentation of Thoreau's great document of social criticism and dissent.",https://www.goodreads.com/book/show/16902.Walden_or_Life_in_the_Woods
Ishmael: An Adventure of the Mind and Spirit,"Daniel Quinn, Daniel Quinn","Fiction, Philosophy, Spirituality, Classics, Fantasy, Book Club, Environment",4.01,"103,536 ratings","7,213 reviews","Librarian's note: An alternate cover edition can be found here

TEACHER SEEKS PUPIL.
Must have an earnest desire to
save the world. Apply in person.

It was just a three-line ad in the personals section, but it launched the adventure of a lifetime...

So begins , an utterly unique and captivating novel that has earned a large and passionate following among readers and critics alike—one of the most beloved and bestselling novels of spiritual adventure ever published.",https://www.goodreads.com/book/show/227265.Ishmael
Fahrenheit 451,"Ray Bradbury, Ray Bradbury","Classics, Fiction, Science Fiction, Dystopia, School, Literature, Audiobook",3.97,"2,776,942 ratings","92,627 reviews","Fahrenheit 451 ofrece la historia de un sombrío y horroroso futuro. Montag, el protagonista, pertenece a una extraña brigada de bomberos cuya misión, paradójicamente, no es la de sofocar incendios sino la de provocarlos, para quemar libros. Porque en el país de Montag está terminantemente prohibido leer. Porque leer obliga a pensar, y en el país de Montag esta prohibido pensar. Porque leer impide ser ingenuamente feliz, y en el país de Montag hay que ser feliz a la fuerza...",https://www.goodreads.com/book/show/4381.Fahrenheit_451
No Gods No Masters: An Anthology of Anarchism,"Daniel Guérin, Paul Sharkey, Daniel Guérin","Politics, Philosophy, Nonfiction, History, Anarchism, Anthologies, Essays",4.14,632 ratings,35 reviews,"The first English translation of Guérin’s monumental anthology of anarchism, published here in one volume. It details a vast array of unpublished documents, letters, debates, manifestos, reports, impassioned calls-to-arms and reasoned analysis; the history, organization and practice of the movement—its theorists, advocates and activists; the great names and the obscure, towering legends and unsung heroes.

This definitive anthology portrays anarchism as a sophisticated ideology whose nuances and complexities highlight the natural desire for freedom in all of us. The classical texts will re-establish anarchism as both an intellectual and practical force to be reckoned with. Includes writings by Emma Goldman, Kropotkin, Berkman, Bakunin, Proudhon, and Malatesta.

was the author of .",https://www.goodreads.com/book/show/61007.No_Gods_No_Masters
The Hands We're Given,"O.E. Tearmann, O.E. Tearmann","Science Fiction, Dystopia, Cyberpunk, Fiction, Audiobook, Romance, M M Romance",4.22,223 ratings,135 reviews,"Aidan Headly never wanted to be the man giving orders. That's fine with the Democratic State Force base he's been assigned to command: they don't like to take orders. Nicknamed the Wildcards, they used to be the most effective base against the seven Corporations owning the former United States in a war that has lasted over half a century. Now the Wildcards are known for creative insubordination, chaos, and commanders begging to be reassigned. Aidan is their last chance. If he can pull off his assignment as Commander and yank his ragtag crew of dreamers and fighters together, maybe they can get back to doing what they came to do: fighting for a country worth living in.
Life's a bitch. She deals off the bottom of the deck. But you play the hands you're given.",https://www.goodreads.com/book/show/51986292-the-hands-we-re-given
The Catcher in the Rye,"J.D. Salinger, J.D. Salinger","Classics, Fiction, Young Adult, Literature, School, Coming Of Age, Novels",3.80,"3,847,463 ratings","100,269 reviews","It's Christmas time and Holden Caulfield has just been expelled from yet another school...

Fleeing the crooks at Pencey Prep, he pinballs around New York City seeking solace in fleeting encounters—shooting the bull with strangers in dive hotels, wandering alone round Central Park, getting beaten up by pimps and cut down by erstwhile girlfriends. The city is beautiful and terrible, in all its neon loneliness and seedy glamour, its mingled sense of possibility and emptiness. Holden passes through it like a ghost, thinking always of his kid sister Phoebe, the only person who really understands him, and his determination to escape the phonies and find a life of true meaning.

is an all-time classic in coming-of-age literature- an elegy to teenage alienation, capturing the deeply human need for connection and the bewildering sense of loss as we leave childhood behind.

(1919–2010) classic novel of teenage angst and rebellion was first published in 1951. The novel was included on 's 2005 list of the 100 best English-language novels written since 1923. It was named by Modern Library and its readers as one of the 100 best English-language novels of the 20th century. It has been frequently challenged in the court for its liberal use of profanity and portrayal of sexuality and in the 1950's and 60's it was the novel that every teenage boy wants to read.",https://www.goodreads.com/book/show/5107.The_Catcher_in_the_Rye
God and the State,"Mikhail Bakunin, Paul Avrich, Mikhail Bakunin","Philosophy, Politics, Nonfiction, Religion, Russia, History, Theory",3.81,"5,226 ratings",380 reviews,"Among the 19th-century founders of modern philosophical anarchism, none is more important than Michael Bakunin (1814–76). Born into the Russian nobility, he renounced his hereditary rank in protest against Czarist oppression and fled to Western Europe. A colorful, charismatic personality, Bakunin quickly became central to the anarchism movement, and everyone involved either built upon or reacted to his ideas. Yet Bakunin, despite the power of his ideas, was primarily a man of action, and he wrote little. His only major work, God and the State, remained unfinished, although it is the torso of a giant.
has been a basic anarchist and radical document for generations. It is one of the clearest statements of the anarchist philosophy of history: religion by its nature is an impoverishment, enslavement, and annihilation of humanity. It is the weapon of the state. It must be smashed, according to Bakunin, before the right of self-determination can be possible. As an introduction to anarchist thought, a manifesto of atheism, or as a summing-up of the thoughts of Bakunin, remains a mind-opening experience, even for those basically unsympathetic to its premise.",https://www.goodreads.com/book/show/436351.God_and_the_State
Living My Life,"Emma Goldman, Miriam Brody, Emma Goldman","Nonfiction, Biography, Politics, Feminism, History, Memoir, Autobiography",4.27,"2,150 ratings",170 reviews,"Anarchist, journalist, drama critic, advocate of birth control and free love, Emma Goldman was the most famous—and notorious—woman in the early twentieth century. This abridged version of her two-volume autobiography takes her from her birthplace in czarist Russia to the socialist enclaves of Manhattan’s Lower East Side. Against a dramatic backdrop of political argument, show trials, imprisonment, and tempestuous romances, Goldman chronicles the epoch that she helped shape: the reform movements of the Progressive Era, the early years of and later disillusionment with Lenin’s Bolshevik experiment, and more. Sounding a call still heard today, Living My Life is a riveting account of political ferment and ideological turbulence.
First time in Penguin Classics


Condensed to half the length of Goldman's original work, this edition is accessible to those interested in the activist and her extraordinary era",https://www.goodreads.com/book/show/51695.Living_My_Life
The Kingdom of God Is Within You,"Leo Tolstoy, Constance Garnett, Leo Tolstoy",N/A,4.12,"4,776 ratings",474 reviews,"Banned in Russia, Tolstoy's The Kingdom of God Is Within You was deemed a threat to church and state. The culmination of a lifetime's thought, it espouses a commitment to Jesus's message of turning the other cheek. In a bold and original manner, Tolstoy shows his readers clearly why they must reject violence of any sort—even that sanctioned by the state or the church—and urges them to look within themselves to find the answers to questions of morality.
In 1894, one of the first English translations of this book found its way into the hands of a young Gandhi. Inspired by its message of nonresistance to evil, the Mahatma declared it a source of ""independent thinking, profound morality, and truthfulness."" Much of this work's emotional and moral appeal lies in its emphasis on fair treatment of the poor and working class. Its view of Christianity, not as a mystic religion but as a workable philosophy originating from the words of a remarkable teacher, extends its appeal to secular and religious readers alike.",https://www.goodreads.com/book/show/658.The_Kingdom_of_God_Is_Within_You
