Title,Author,Genres,Avg_Rating,Num_Ratings,Num_Reviews,Description,Book_URL
Blackshirts and Reds: Rational Fascism and the Overthrow of Communism,"Michael Parenti, Michael Parenti","Politics, History, Nonfiction, Theory, Philosophy, Economics, Sociology",4.39,"8,917 ratings","1,101 reviews","Blackshirts & Reds explores some of the big issues of our time: fascism, capitalism, communism, revolution, democracy, and ecology—terms often bandied about but seldom explored in the original and exciting way that has become Michael Parenti’s trademark.

Parenti shows how “rational fascism” renders service to capitalism, how corporate power undermines democracy, and how revolutions are a mass empowerment against the forces of exploitative privilege. He also maps out the external and internal forces that destroyed communism, and the disastrous impact of the “free-market” victory on eastern Europe and the former Soviet Union. He affirms the relevance of taboo ideologies like Marxism, demonstrating the importance of class analysis in understanding political realities and dealing with the ongoing collision between ecology and global corporatism.

Written with lucid and compelling style, this book goes beyond truncated modes of thought, inviting us to entertain iconoclastic views, and to ask why things are as they are. It is a bold and entertaining exploration of the epic struggles of yesterday and today.

""A penetrating and persuasive writer with an astonishing array of documentation to implement his attacks.""—

discusses the great combat between fascism and socialism that is the defining feature of the Twentieth Century, and takes every official version to task for its substitution of moral analysis for critical analysis, for its selectivity, and for its errata. By portraying the struggle between fascism and Communism in this century as a single conflict, and not a series of discrete encounters, between the insatiable need for new capital on the one hand and the survival of a system under siege on the other, Parenti defines fascism as the weapon of capitalism, not simply an extreme form of it. Fascism is not an aberration, he points out, but a ""rational"" and integral component of the system.""—Stan Goff,

, PhD Yale, is an internationally known author and lecturer. He is one of the nation's leading progressive political analysts. He is the author of over 275 published articles and twenty books. His writings are published in popular periodicals, scholarly journals, and his op-ed pieces have been in leading newspapers such as and . His informative and entertaining books and talks have reached a wide range of audiences in North America and abroad.",https://www.goodreads.com/book/show/404273.Blackshirts_and_Reds
Anarchism: Arguments For and Against,"Albert Meltzer, Albert Meltzer","Nonfiction, Politics, Philosophy, History, Anarchism",3.27,211 ratings,12 reviews,"This is the second revised edition of Anarchism: Arguments For and Against and was the edition that Albert Meltzer was working on at the time of his death on May 7th, 1996. This book was an important one to Albert and it was one whose arguments he came back to often in his other writings.

Albert had become increasingly concerned about what he saw as the ghettoisation of anarchism. Separated from the working class base so necessary to achieve social revolution, anarchism could easily fall into the twin traps of philosophical radicalism or revolutionary arrogance, the ""we're more militant than anyone else"" approach. Both stands have appeared in British anarchism alongside a sometimes demoralising and destructive incestuous approach to revolutionary change. Anarchists talk only to other anarchists and are unable to relate to the vast majority of people who are not of their belief and see anarchism as a rather exotic or illogical idea.

This then was Albert's attempt to examine arguments people may have about why anarchism can never work and to counter them. He also examines the basic tenets of anarchist thought and practice and in doing so destroys some of the myths that have been created about anarchist theory and action. It's a book fro those of us who try to win people over to our ideas in everyday life and such it is a book that tries to break down the walls of the ghetto that anarchism has become trapped in.",https://www.goodreads.com/book/show/61005.Anarchism
A Country of Ghosts,"Margaret Killjoy, Margaret Killjoy","Fantasy, Fiction, Queer, Science Fiction, LGBT, Politics, Speculative Fiction",4.13,"1,343 ratings",225 reviews,"Dimos Horacki is a Borolian journalist and a cynical patriot, his muckraking days behind him. But when his newspaper ships him to the front, he's embedded in the Imperial Army and the reality of colonial expansion is laid bare before him. His adventures take him from villages and homesteads to the great refugee city of Hronople, built of glass, steel, and stone, all the while a war rages around him. The empire fights for coal and iron, but the anarchists of Hron fight for their way of life.
From the editor of Mythmakers & Lawbreakers: Anarchist Writers on Fiction and author of What Lies Beneath the Clock Tower comes a seditious novel of utopia besieged, a novel that challenges every premise of contemporary society.",https://www.goodreads.com/book/show/20610031-a-country-of-ghosts
"Αντάρτικα Τραγούδια, Αντιστασιακή Ποίηση","Γιώργης Πικρός, Γιώργης Πικρός",N/A,0.00,0 ratings,0 reviews,,https://www.goodreads.com/book/show/23434400
Gerechtigheid,"Stieg Larsson, Tineke Jorissen-Wedzinga, Stieg Larsson","Fiction, Mystery, Thriller, Crime, Mystery Thriller, Suspense, Audiobook",4.24,"771,424 ratings","32,678 reviews","Twee tegenpolen, Mikael Blomkvist en Lisbeth Salander. Hij is een charmante man en een kritische journalist van middelbare leeftijd, en uitgever van het beroemde en beruchte tijdschrift Millennium. Zij is een jonge, gecompliceerde, uiterst intelligente vrouw met zwartgeverfd haar, piercings en tattoos én ze is een computerhacker van wereldklasse.

Lisbeth Salander heeft een levensbedreigende aanslag overleefd en wordt in kritieke toestand naar het ziekenhuis gebracht, evenals de man die verantwoordelijk is voor haar duistere, pijnlijke verleden: Alexander Zalachenko. Salander wordt gezocht voor moord en door de media is ze neergezet als een psychopaat, moordenaar en satanist. Alleen Blomkvist is overtuigd van haar onschuld. Hij ontdekt de relatie tussen de vrouwenhandel, het verleden van Salander en de Zweedse veiligheidsdienst en wil daarover publiceren. Maar wil Salander wel meewerken? Ze vertrouwt niemand en zeker Blomkvist niet, die haar als enige veel te goed kent. Uiteindelijk moet ze voor de rechtbank verschijnen. Zal het recht zegevieren?",https://www.goodreads.com/book/show/6459543-gerechtigheid
Solidarity Divided: The Crisis in Organized Labor and a New Path toward Social Justice,"Bill Fletcher Jr., Fernando Gapasin, Bill Fletcher Jr.","Labor, Politics, History, Nonfiction, Economics, American History",4.01,115 ratings,16 reviews,"The U.S. trade union movement finds itself today on a global battlefield filled with landmines and littered with the bodies of various social movements and struggles. Candid, incisive, and accessible, Solidarity Divided is a critical examination of labor's current crisis and a plan for a bold new way forward into the twenty-first century. Bill Fletcher and Fernando Gapasin, two longtime union insiders whose experiences as activists of color grant them a unique vantage on the problems now facing U.S. labor, offer a remarkable mix of vivid history and probing analysis. They chart changes in U.S. manufacturing, examine the onslaught of globalization, consider the influence of the environment on labor, and provide the first broad analysis of the fallout from the 2000 and 2004 elections on the U.S. labor movement. Ultimately calling for a wide-ranging reexamination of the ideological and structural underpinnings of today's labor movement, this is essential reading for understanding how the battle for social justice can be fought and won.",https://www.goodreads.com/book/show/3311552-solidarity-divided
Our Friends From Frolix 8,"Philip K. Dick, Philip K. Dick",N/A,3.58,"3,564 ratings",300 reviews,"In Our Friends From Frolix 8, Philip K Dick clashes private dreams against public battles in a fast-paced and provocative tale.

Nick Appleton is a menial laborer whose life is a series of endless frustrations. Willis Gram is the despotic oligarch of a planet ruled by big-brained elites. When they both fall in love with Charlotte Boyer, a feisty black marketer of revolutionary propaganda, Nick seems destined for doom. But everything takes a decidedly unpredictable turn when the revolution’s leader, Thors Provoni, returns from ten years of intergalactic hiding with a ninety-ton protoplasmic slime that is bent on creating a new world order.

Winner of both the Hugo and John W. Campbell awards for best novel, widely regarded as the premiere science fiction writer of his day, and the object of cult-like adoration from his legions of fans, Philip K. Dick has come to be seen in a literary light that defies classification in much the same way as Borges and Calvino. With breathtaking insight, he utilizes vividly unfamiliar worlds to evoke the hauntingly and hilariously familiar in our society and ourselves.",https://www.goodreads.com/book/show/756108.Our_Friends_From_Frolix_8
Atlas Shrugged,"Ayn Rand, Leonard Peikoff, Ayn Rand","Fiction, Classics, Philosophy, Politics, Literature, Science Fiction, Novels",3.69,"405,060 ratings","21,376 reviews","This is the story of a man who said that he would stop the motor of the world and did. Was he a destroyer or the greatest of liberators?

Why did he have to fight his battle, not against his enemies, but against those who needed him most, and his hardest battle against the woman he loved? What is the world’s motor — and the motive power of every man? You will know the answer to these questions when you discover the reason behind the baffling events that play havoc with the lives of the characters in this story.

Tremendous in its scope, this novel presents an astounding panorama of human life — from the productive genius who becomes a worthless playboy — to the great steel industrialist who does not know that he is working for his own destruction — to the philosopher who becomes a pirate — to the composer who gives up his career on the night of his triumph — to the woman who runs a transcontinental railroad — to the lowest track worker in her Terminal tunnels.



This is a mystery story, not about the murder — and rebirth — of man’s spirit. It is a philosophical revolution, told in the form of an action thriller of violent events, a ruthlessly brilliant plot structure and an irresistible suspense. Do you say this is impossible? Well, is the first of your premises to check.",https://www.goodreads.com/book/show/662.Atlas_Shrugged
Drug Lord,"Douglas R. Casey, John F. Hunt, Douglas R. Casey","Fiction, Novels, Adventure, Philosophy, Business",4.55,251 ratings,27 reviews,"Famed international man and #1 bestselling author Doug Casey—in collaboration with John Hunt—releases DRUG LORD, Book 2 of the High Ground Novels.

Charles Knight returns to the United States after seven years traveling the world. He embarks on two concurrent professions: one as a major investor in a small pharmaceutical company, and the other as the head of a black market drug-smuggling and -distribution operation. Charles has to sort through the legal and illegal, moral and immoral, and right and wrong as he navigates the War on Drugs and the crony pharmaceutical industry.",https://www.goodreads.com/book/show/36153576-drug-lord
Towards a Critique of the Category of Totalitarianism,"Domenico Losurdo, Domenico Losurdo","Politics, Philosophy, Nonfiction, History, Theory",4.51,63 ratings,9 reviews,"This piece was originally published in Historical Materialism (Brill Academic Publishers), volume 12:2 (2004).",https://www.goodreads.com/book/show/40697029-towards-a-critique-of-the-category-of-totalitarianism
Adventures with Ed: A Portrait of Abbey,"Jack Loeffler, Jack Loeffler","Biography, Nature, Environment, Nonfiction",4.15,110 ratings,14 reviews,"No writer has had a greater influence on the American West than Edward Abbey (1927-89), author of twenty-one books of fiction and nonfiction. This long-awaited biographical memoir by one of Abbey's closest friends is a tribute to the gadfly anarchist who popularized environmental activism in his novel The Monkey Wrench Gang and articulated the spirit of the arid West in Desert Solitaire and scores of other essays and articles. In the course of a twenty-year friendship Ed Abbey and Jack Loeffler shared hundreds of campfires, hiked thousands of miles, and talked endlessly about the meaning of life. To read Loeffler's account of his best pal's life and work is to join in their friendship. Born and raised in Pennsylvania, Abbey came west to attend the University of New Mexico on the G.I. Bill. His natural inclination toward anarchism led him to study philosophy, but after earning an M.A. he rejected academic life and worked off and on for years as a backcountry ranger and fire lookout around the Southwest. His 1956 novel The Brave Cowboy launched his literary career, and by the 1970s he was recognized as an important, uniquely American voice. Abbey used his talents to protest against the mining and development of the American West. By the time of his death he had become an idol to environmentalists, writers, and free spirits all over the West. ""Ed Abbey and Jack Loeffler were like Don Quijote and Sancho Panza. Loeffler delivers his friend, warts and all on a platter full of reverence and irreverence and carefully researched factual information, interspersed with hearty laughter and much serious consideration of all life's Great Questions. Jack's story elucidates and demythifies the Abbey legend, giving us powerful flesh and blood instead.""--John Nichols",https://www.goodreads.com/book/show/838429.Adventures_with_Ed
Deep Ecology & Anarchism,"Murray Bookchin, Graham Purchase, Brian Morris, Murray Bookchin","Nonfiction, Politics, Ecology, Anarchism, Nature, Research",3.54,80 ratings,3 reviews,"Debate by various luminaries on deep ecology, social ecology, and anarchism.",https://www.goodreads.com/book/show/247821.Deep_Ecology_Anarchism
There Is Power in a Union: The Epic Story of Labor in America,"Philip Dray, Philip Dray","History, Nonfiction, Labor, Politics, American History, Economics, Business",4.19,841 ratings,99 reviews,"From an award-winning historian, a stirring (and timely) narrative history of American labor from the dawn of the industrial age to the present day.

From the textile mills of Lowell, Massachusetts, the first real factories in America, to the triumph of unions in the twentieth century and their waning influence today, the con­test between labor and capital for their share of American bounty has shaped our national experience. Philip Dray’s ambition is to show us the vital accomplishments of organized labor in that time and illuminate its central role in our social, political, economic, and cultural evolution. is an epic, character-driven narrative that locates this struggle for security and dignity in all its various settings: on picket lines and in union halls, jails, assembly lines, corporate boardrooms, the courts, the halls of Congress, and the White House. The author demonstrates, viscerally and dramatically, the urgency of the fight for fairness and economic democracy—a struggle that remains especially urgent today, when ordinary Americans are so anxious and beset by eco­nomic woes.",https://www.goodreads.com/book/show/8501350-there-is-power-in-a-union
The Shattered Chain,"Marion Zimmer Bradley, Marion Zimmer Bradley","Fantasy, Science Fiction, Fiction, Science Fiction Fantasy, Speculative Fiction, Audiobook, Sci Fi Fantasy",3.95,"2,999 ratings",80 reviews,"The women of Darkover are treated like slaves, despite the fact that they alone can control the power of the matrix, but the Free Amazons provide a key to the future",https://www.goodreads.com/book/show/1086458.The_Shattered_Chain
We the Living,"Ayn Rand, Ayn Rand","Fiction, Classics, Philosophy, Historical Fiction, Literature, Politics, Russia",3.96,"30,619 ratings","1,727 reviews","Ayn Rand's first published novel, a timeless story that explores the struggles of the individual against the state in Soviet Russia.

First published in 1936, 'We the Living' portrays the impact of the Russian Revolution on three human beings who demand the right to live their own lives and pursue their own happiness. It tells of a young woman’s passionate love, held like a fortress against the corrupting evil of a totalitarian state.

is not a story of politics, but of the men and women who have to struggle for existence behind the Red banners and slogans. It is a picture of what those slogans do to human beings. What happens to the defiant ones? What happens to those who succumb?

Against a vivid panorama of political revolution and personal revolt, Ayn Rand shows what the theory of socialism means in practice.

(1905–1982) was born in pre-revolutionary St. Petersburg to a prosperous Jewish family as Alisa Rosenbaum. When the Bolsheviks requisitioned her family's business, they fled to the Crimea, and she later moved to America as soon as she was offered the chance. After beginning her writing career with screenplays, she published the novel in 1936. Her status was later established with and her magnus opus, Also a prolific non-fiction writer, as well as the founder of the philosophical school of Objectivism, she has had an unequivocal impact on both literature and culture, regardless of one's perspective of her works.",https://www.goodreads.com/book/show/668.We_the_Living
Jean Grave - Oeuvres,"Jean Grave, Jean Grave",N/A,0.00,0 ratings,0 reviews,"Le Classcompilé n° 131 contient les oeuvres de Jean Grave. Jean Grave , né le 16 octobre 1854 à Le Breuil-sur-Couze (Puy-de-Dôme) et mort à Vienne-en-Val (Loiret) le 8 décembre 1939, est un militant anarchiste français. Initialement socialiste, il devient communiste libertaire à partir de 1880 et popularise les idées de Pierre Kropotkine. Il participe au journal Le Révolté d'Élisée Reclus. Lors de la Première Guerre mondiale, il est l’un des signataires du Manifeste des seize rassemblant les libertaires partisans de l'Union sacrée face à l'Allemagne. 'Wikip.) CONTENU DE CE VOLUME : SOCIOLOGIE
La société mourante et l’anarchie 1895
La Société future 1895
L’individu et la société 1897
L’Anarchie, son but, ses moyens 1899
Réformes, Révolution 1909
Articles 1895 à 1920
ROMAN
La Grande Famille 1896
CONTE POUR ENFANTS
Les Aventures de Nono 1901 Les livrels de lci-eBooks sont des compilations d’œuvres appartenant au domaine public : les textes d’un même auteur sont regroupés dans un eBook à la mise en page soignée, pour la plus grande commodité du lecteur. On trouvera le catalogue sur le site de l'éditeur.",https://www.goodreads.com/book/show/35661435-jean-grave---oeuvres
Bourgeois Democracy and Fascism,"Harpal Brar, Harpal Brar",Nonfiction,4.17,6 ratings,0 reviews,,https://www.goodreads.com/book/show/59826021-bourgeois-democracy-and-fascism
The Fool's Progress,"Edward Abbey, Edward Abbey","Fiction, Novels, Travel, Nature, Environment, Literature, Contemporary",4.22,"3,811 ratings",315 reviews,"The Fool's Progress, the ""fat masterpiece"" as Edward Abbey labeled it, is his most important piece of it reveals the complete Ed Abbey, from the green grass of his memory as a child in Appalachia to his approaching death in Tuscon at age sixty two. When his third wife abandons him in Tucson, boozing, misanthropic anarchist Henry Holyoak Lightcap shoots his refrigerator and sets off in a battered pick-up truck for his ancestral home in West Virginia. Accompanied only by his dying dog and his memories, the irascible warhorse (a stand-in for the ""real"" Abbey) begins a bizarre cross-country odyssey--determined to make peace with his past--and to wage one last war against the ravages of ""progress.""""A profane, wildly funny, brash, overbearing, exquisite tour de force."" -- The Chicago Tribune",https://www.goodreads.com/book/show/118541.The_Fool_s_Progress
The Teenage Liberation Handbook: How to Quit School and Get a Real Life and Education,"Grace Llewellyn, Grace Llewellyn","Education, Nonfiction, Parenting, Teaching, Reference, Self Help, School",4.22,"1,361 ratings",157 reviews,"An estimated 700,000 American children are now taught at home. This book tells teens how to take control of their lives and get a ""real life."" Young people can reclaim their natural ability to teach themselves and design a personalized education program. Grace Llewellyn explains the entire process, from making the decision to quit school, to discovering the learning opportunities available.",https://www.goodreads.com/book/show/305758.The_Teenage_Liberation_Handbook
Writings of Eugene V. Debs,"Eugene V. Debs, Eugene V. Debs","Politics, Nonfiction, History, Classics, Philosophy, World War I, Essays",4.43,111 ratings,8 reviews,"A collection of speeches, pamphlets and writings from Eugene V Debs, from 1888 to 1925. Beginning his career as an organizer for the American Railway Union, Debs ran for President on the Socialist Party ticket five times, polling up to 6 percent of the total vote in 1912. Jailed in 1919 for an antiwar speech in Ohio, Debs ran for President from his jail cell in 1920, polling almost a million votes, 3.4 percent of the total votes cast.",https://www.goodreads.com/book/show/6516199-writings-of-eugene-v-debs
Direct Struggle Against Capital: A Peter Kropotkin Anthology,"Pyotr Kropotkin, Iain Mckay, Pyotr Kropotkin","Politics, Philosophy, Nonfiction, History, Anarchism, Anthologies",4.29,41 ratings,3 reviews,"""The enemy on whom we declare war is capital, and it is against capital that we will direct all our efforts, taking care not to become distracted from our goal by the phony campaigns and arguments of the political parties. The great struggle that we are preparing for is essentially economic, and so it is on the economic terrain that we should focus our activities."" —Peter Kropotkin Peter Kropotkin is by far anarchism’s most influential theorist, and Direct Struggle Against Capital is the most extensive collection of his writings available in English. Over half the selections have been translated for the first time or recovered from long-out-of-print pamphlets and newspapers. The result is a volume that provides an introduction to classic texts, while showing new facets of a familiar and canonical figure. Direct Struggle Against Capital paints a detailed portrait of Kropotkin the revolutionary, the man Emma Goldman described as someone for whom anarchism “was not an ideal for the select few. It was a constructive social theory, destined to usher in a new world for all of mankind.” Fully annotated and featuring a lengthy historical introduction, biographical sketch, glossary, bibliography, and index.
Peter Kropotkin (1842—1921) was one of anarchism's most famous thinkers. His classic works include Conquest of Bread ; Fields, Factories and Workshops ; Memoirs of a Revolutionist ; and Mutual A Factor of Evolution . Iain McKay is author of An Anarchist FAQ (volumes 1 & 2) and Property Is A Pierre-Joseph Proudhon Anthology .",https://www.goodreads.com/book/show/17675240-direct-struggle-against-capital
